"logFC","logCPM","F","PValue","FDR","Species"
-0.148620183629628,1.78600705836899,1.5160125524477,0.22220788763925,0.935072987620467,"Rhinovirus B, Rhinovirus B35 (Strain), Rhinovirus B3 (Strain)"
-0.0821453280109923,7.78217685028029,1.48212266440924,0.227395232619897,0.935072987620467,"Rhinovirus B, Rhinovirus B84 (Strain)"
-0.109162088014276,7.75129485147466,1.61216635625438,0.20825284748361,0.935072987620467,"Rhinovirus B, Rhinovirus B86 (Strain)"
-0.300647270987145,3.37623205776722,1.46068667972129,0.230752757006058,0.935072987620467,"Rhinovirus C, Rhinovirus C_AER92563.1 (Strain)"
-0.0795700372047765,8.02631115070399,1.48421888726905,0.227070117265754,0.935072987620467,"Rhinovirus C, Rhinovirus C17 (Strain)"
-0.264891306465118,4.79119640309226,1.53730876757442,0.21902182075688,0.935072987620467,"Rhinovirus C, Rhinovirus C50 (Strain)"
-0.12978179332782,6.35651709253783,1.57346520644798,0.213738446090114,0.935072987620467,"Rhinovirus C, Rhinovirus C54 (Strain)"
-0.172055005731409,1.49991885034577,1.46955779658261,0.229355963249381,0.935072987620467,"Rhinovirus C, Rhinovirus C8 (Strain), Rhinovirus C9 (Strain)"
-0.0141530296905324,9.09929644439521,1.61943957320437,0.207240937376414,0.935072987620467,"Rift Valley fever phlebovirus"
0.0342420600098659,7.10224230585031,1.45571087601845,0.231540779993968,0.935072987620467,"Sapporo virus, unclassified Sapovirus"
-0.0782331678420004,6.28160438141944,1.50008612408478,0.22462749141635,0.935072987620467,"Torque teno midi virus 14"
0.0603580514676269,6.1531023392096,1.49454109932782,0.225477439585641,0.935072987620467,"Torque teno midi virus 8"
0.0237565267924444,6.76118540593225,1.45740170356638,0.231272632483391,0.935072987620467,"Torque teno virus 24"
-0.136266359899816,1.91809286889923,1.4972735193811,0.22505812169058,0.935072987620467,"unclassified Enterovirus, Rhinovirus A, Rhinovirus A58 (Strain)"
0.0103803923815061,11.4686344614826,1.60454606941488,0.209319427752259,0.935072987620467,"unclassified Gammapapillomavirus"
0.0160247393984948,8.40130753195466,1.45711697916489,0.231317760119688,0.935072987620467,"unclassified Gammaretrovirus"
0.0103296012620986,11.7907964200911,1.60579038304729,0.209144817939746,0.935072987620467,"unclassified Mamastrovirus"
0.016235816776808,8.3043965349425,1.5567833436115,0.216156690862934,0.935072987620467,"unclassified Primate lentivirus group"
0.0679304947385371,3.4705138281539,1.75253467831025,0.217882121305361,0.935072987620467,"Venezuelan equine encephalitis virus, Madariaga virus, Eastern equine encephalitis virus"
-0.0178123438361675,8.26436422113106,1.51304126798656,0.222656879501937,0.935072987620467,"Wesselsbron virus"
0.0165298762615934,7.94428018149174,1.39931378952278,0.24070783177253,0.935917678016938,"Andes orthohantavirus"
0.0171355192770839,8.21716409138118,1.41423752273708,0.238239215372282,0.935917678016938,"Barmah Forest virus"
-0.175642444152724,1.04428467121123,1.40031999830779,0.240540399216347,0.935917678016938,"Cowpox virus, Monkeypox virus, Vaccinia virus, Variola virus, Camelpox virus"
-0.0516961876421035,6.78144500824449,1.40931647462601,0.23904976491234,0.935917678016938,"Enterovirus A, Coxsackievirus A16 (Strain)"
-0.176498922181517,3.32393746030094,1.4364092850822,0.234629010599533,0.935917678016938,"Enterovirus A, Enterovirus A90 (Strain), Enterovirus A91 (Strain), Enterovirus A121 (Strain)"
0.129831370965293,2.12580173732608,1.44220215491204,0.233696875061717,0.935917678016938,"Enterovirus A, unclassified Enterovirus, Coxsackievirus A2 (Strain)"
0.126207316231559,2.62625781223349,1.42620425611812,0.236282257247665,0.935917678016938,"Enterovirus C, Human Poliovirus 1 Mahoney (Strain)"
-0.0244951034482876,6.45574264832186,1.54920805567901,0.234499878601098,0.935917678016938,"Gemyvongvirus humas1"
0.0742283319502121,3.27634805826828,1.42938962909908,0.235764682699796,0.935917678016938,"Human coronavirus HKU1 (isolate N1), Human coronavirus HKU1, Bovine coronavirus, Betacoronavirus 1"
0.170990872781849,1.15266871895836,1.69276314502493,0.238927572111334,0.935917678016938,"Human immunodeficiency virus 1 (HIV-1), HIV-1 M:B (subtype), HIV-1 M:F (subtype), HIV-1 M:K (subtype), HIV-1 M:J (subtype)"
-0.0646099480921645,3.590334824557,1.42604208368999,0.236308645189646,0.935917678016938,"Human immunodeficiency virus 1 (HIV-1), HIV-1 O_A (subtype), HIV-1 O_M (subtype)"
0.116361379869886,2.00283470007393,1.6969809048492,0.238425483870212,0.935917678016938,"Influenza A virus, Influenza A virus H3N2 (subtype), Influenza A virus H1N1 (subtype), Influenza A virus H1N2 (subtype)"
0.058645055497201,7.27249987733051,1.44445333520924,0.233335863615145,0.935917678016938,"KI polyomavirus"
0.118946571678439,2.07414336988615,1.54015395785212,0.239436297182514,0.935917678016938,"Lyssavirus duvenhage, Lyssavirus hamburg, Lyssavirus irkut, Lyssavirus rabies"
0.083207000916257,3.43530619439069,1.43577260738069,0.23473173742199,0.935917678016938,"Monkeypox virus, Cowpox virus, Akhmeta virus, Vaccinia virus, unclassified Orthopoxvirus, Camelpox virus, Ectromelia virus"
-0.12364988032718,2.13935107361651,1.41225629092174,0.238565137248304,0.935917678016938,"Rhinovirus A, Rhinovirus A10 (Strain), Human Rhinovirus A44 (Strain), Rhinovirus A59 (Strain), Rhinovirus A25 (Strain), Rhinovirus A31 (Strain), Rhinovirus A40 (Strain), Rhinovirus A56 (Strain), Rhinovirus A63 (Strain), Rhinovirus A85 (Strain)"
0.108099530515268,2.35961205660797,1.4466330646961,0.232986962751581,0.935917678016938,"Rhinovirus A, unclassified Rhinovirus, Rhinovirus A85 (Strain)"
-0.0787810585534464,3.47354969556672,1.39852055432567,0.240839927174883,0.935917678016938,"Rhinovirus B, unclassified Rhinovirus, Rhinovirus B37 (Strain)"
-0.184366290262336,1.67105739633352,1.4186728424994,0.237511572496307,0.935917678016938,"Rhinovirus B, unclassified Rhinovirus, Rhinovirus B6 (Strain), Rhinovirus B37 (Strain), Rhinovirus B103 (Strain)"
-0.089488642293944,8.23119462597995,1.42327130373029,0.236760054681545,0.935917678016938,"Rhinovirus C, Rhinovirus C15 (Strain)"
0.132160955924629,1.68897485181794,1.61833965719157,0.238103056825502,0.935917678016938,"unclassified Enterovirus, Enterovirus C, Enterovirus C102 (Strain)"
0.354120272455069,4.15820758616499,1.40746903278222,0.23935493665395,0.935917678016938,"unclassified Rhinovirus, Rhinovirus A, Rhinovirus A102 (Strain), Rhinovirus A65 (Strain), Rhinovirus A71 (Strain), Rhinovirus A106 (Strain)"
0.50897618318666,3.48356501468025,1.39996871264025,0.240598836592004,0.935917678016938,"unclassified Rhinovirus, Rhinovirus A64 (Strain)"
0.0715110249849993,3.5484459605726,1.4051764014225,0.239734316467667,0.935917678016938,"Variola virus, Akhmeta virus, Camelpox virus"
0.0150124887415866,7.90242604985043,1.35565392009354,0.24811386154431,0.936584699001515,"Cache Valley orthobunyavirus"
0.0720102172742011,3.39469425769768,1.50920251525891,0.241744608005727,0.936584699001515,"Cowpox virus, Vaccinia virus, Variola virus"
-0.142523440647607,1.53602043546429,1.70518202372533,0.243092654173208,0.936584699001515,"Enterovirus A, Enterovirus A92 (Strain), Enterovirus A120 (Strain)"
0.0969741570282481,4.75390861202296,1.37287810923215,0.24515883115639,0.936584699001515,"Enterovirus A, unclassified Enterovirus, Enterovirus A89 (Strain)"
0.114034059051094,1.9309033463377,1.39183933287796,0.244007538391684,0.936584699001515,"Enterovirus C, Poliovirus 3_AAA46914.1 (Strain), Coxsackievirus A11 (Strain), Coxsackievirus A13 (Strain), Coxsackievirus A24 (Strain), Human Poliovirus 1 Mahoney (Strain), Human Poliovirus 1 Strain Sabin (Strain), Poliovirus 2_CAA25246.1 (Strain), Poliovirus 3_CAA25444.1 (Strain)"
-0.233241681359746,1.71474771573661,1.36249938915662,0.246934164078102,0.936584699001515,"Enterovirus C, unclassified Enterovirus, Coxsackievirus A21 (Strain), Coxsackievirus A24 (Strain)"
-0.0991384694023946,2.37745411365533,1.79063841002607,0.24811619297188,0.936584699001515,"Enterovirus C, unclassified Enterovirus, Poliovirus 2_AAA46912.1 (Strain)"
0.103531927408175,2.71379962987824,1.35582848577782,0.24808369123285,0.936584699001515,"Enterovirus C, unclassified Enterovirus, Poliovirus 2_AAA46912.1 (Strain), Poliovirus 3_AAA46914.1 (Strain), Coxsackievirus A13 (Strain), Coxsackievirus A17 (Strain), Coxsackievirus A21 (Strain), Coxsackievirus A24 (Strain), Enterovirus C99 (Strain), Enterovirus C102 (Strain), Human Poliovirus 1 Mahoney (Strain), Human Poliovirus 1 Strain Sabin (Strain), Poliovirus 2_CAA25246.1 (Strain), Poliovirus 3_CAA25444.1 (Strain)"
0.0203547488377735,10.5047853823388,1.35892843390685,0.247548684019998,0.936584699001515,"Hepatitis delta virus"
0.0707457426403354,3.34718585839356,1.35559367507091,0.248124274793629,0.936584699001515,"Human alphaherpesvirus 1 (Herpes simplex virus 1; HHV-1; HSV-1), Human alphaherpesvirus 2 (Herpes simplex virus 2; HHV-2; HSV-2), Papiine alphaherpesvirus 2"
-0.0295384982973512,8.54926392506151,1.36868974648659,0.245873358777394,0.936584699001515,"Human orthorubulavirus 2"
-0.0197228079519726,9.24527289937854,1.37571029626085,0.244677124403876,0.936584699001515,"Japanese encephalitis virus"
-0.0442965689967985,5.08999298407225,1.58678781608254,0.247039199160386,0.936584699001515,"Mamastrovirus 5, unclassified Mamastrovirus"
0.0540425953149495,4.35497929358101,1.64213825302513,0.245442500518749,0.936584699001515,"Orthohantavirus tulaense, Orthohantavirus puumalaense"
0.0300661609943041,6.16458196882373,1.39171253056376,0.241977342894276,0.936584699001515,"Porcine circovirus 1"
0.09938094517049,2.69079014032987,1.38394889549369,0.243282534394173,0.936584699001515,"Rhinovirus A, Rhinovirus A65 (Strain), Rhinovirus A101 (Strain), Rhinovirus A103 (Strain), Rhinovirus A106 (Strain)"
-0.212501293958586,5.26739222693137,1.36755662631173,0.246067111220165,0.936584699001515,"Rhinovirus A, Rhinovirus A96 (Strain)"
0.108161412148429,2.06684080074989,1.36270819303168,0.248238305638133,0.936584699001515,"Rift Valley fever phlebovirus, Punta Toro phlebovirus"
-0.0516954471134766,5.43832515856904,1.36964967184145,0.245709369097864,0.936584699001515,"Seoul orthohantavirus"
0.0183261134709,9.82481391219579,1.37461600611309,0.244863105233792,0.936584699001515,"unclassified Dependoparvovirus"
-0.15532628019481,1.29188148763355,1.59920778216194,0.248726066014339,0.93706099289123,"Variola virus, Monkeypox virus"
0.0846100446745723,2.76383261921437,1.37352920244959,0.250607592955022,0.94014474967925,"Monkeypox virus, Cowpox virus, Camelpox virus"
0.0223159138542319,6.97165860410234,1.34028162660887,0.250788669379938,0.94014474967925,"unclassified Gammapapillomavirus, Gammapapillomavirus 18"
-0.113812416968962,2.04227767462822,1.33910184354945,0.25099543471375,0.94014474967925,"West Nile virus, Murray Valley encephalitis virus"
0.0550491631718597,4.13105787997845,1.34471923313841,0.250012846022847,0.94014474967925,"Zaire ebolavirus, Bundibugyo ebolavirus, Tai Forest ebolavirus"
0.0118070964694708,9.95026848039247,1.33665492702783,0.251424952237199,0.940394626549523,"Venezuelan equine encephalitis virus"
0.0189673689265009,8.03774260683295,1.32347355218978,0.253754581357459,0.942165778859175,"Cosavirus D"
0.142581562355099,1.44844976773299,1.82944973634116,0.254392889757825,0.942165778859175,"Dengue virus 1, Powassan virus, Dengue virus, Yellow fever virus, Kyasanur Forest disease virus, Zika virus, Usutu virus"
-0.0953436700147607,2.51443545772838,1.31960775095901,0.254442918673388,0.942165778859175,"Enterovirus A, unclassified Enterovirus, Enterovirus A121 (Strain)"
0.295237566661023,0.176726284708666,1.33157609326258,0.252319391974618,0.942165778859175,"Rhinovirus A, unclassified Rhinovirus, Rhinovirus A43 (Strain)"
0.0106697633030691,10.0193486474761,1.32420554508689,0.25362450632057,0.942165778859175,"Rocahepevirus ratti"
0.0483378559870539,6.69500928824815,1.3265709118164,0.253204750254115,0.942165778859175,"Torque teno midi virus 1"
0.106904382422148,2.26740871800409,1.31976093511087,0.254415598596651,0.942165778859175,"unclassified Enterovirus, Echovirus E14 (Strain)"
0.0122858497519202,10.1269797811842,1.31257611425538,0.255700957640677,0.9428050644992,"Bovine leukemia virus"
-0.115697583889231,1.92270685348065,1.31254370054376,0.255706774823664,0.9428050644992,"La Crosse orthobunyavirus, Jamestown Canyon orthobunyavirus, Snowshoe hare orthobunyavirus, Tahyna orthobunyavirus"
-0.0903437366249423,2.71107448170371,1.31297823761254,0.255628803652092,0.9428050644992,"Vaccinia virus, Monkeypox virus, Variola virus, unclassified Orthopoxvirus"
-0.0111977332418099,9.74753984678311,1.30486302997053,0.257089886067179,0.943576174988089,"Lyssavirus lagos"
-0.0995543117022483,2.88755460858489,1.30393109991247,0.257258342298372,0.943576174988089,"Lyssavirus rabies, Lyssavirus lagos, Lyssavirus duvenhage"
-0.199178617246914,6.19986647551446,1.30885704803703,0.256369489166659,0.943576174988089,"Rhinovirus A, unclassified Rhinovirus, Rhinovirus A59 (Strain)"
-0.0164041873670105,7.48618006677932,1.30330247646166,0.257372050816581,0.943576174988089,"Yaba monkey tumor virus, Tanapox virus"
0.12517818388355,1.8094799573308,1.6490575429535,0.258519041790438,0.945097159894365,"Akhmeta virus, unclassified Orthopoxvirus, Ectromelia virus"
-0.103785366428601,2.35897196499985,1.29802635563263,0.258328911050174,0.945097159894365,"Cowpox virus, Vaccinia virus, Variola virus, unclassified Orthopoxvirus, Camelpox virus"
0.0164078836420709,7.9023586181303,1.29031316672159,0.259735800519035,0.945097159894365,"Ilesha orthobunyavirus"
-0.0237010810943654,6.57847623899443,1.29428824687649,0.259009545544428,0.945097159894365,"Monkeypox virus, unclassified Orthopoxvirus"
0.125182130740834,1.74981512956807,1.28900893746893,0.259974643134522,0.945097159894365,"Rhinovirus A, Rhinovirus B"
-0.079320768303919,3.12949722106091,1.97441712383496,0.259575353493908,0.945097159894365,"unclassified Pegivirus, Pegivirus platyrrhini, Pegivirus H"
0.0125574184214874,9.36453696261524,1.20892179516471,0.275187810536429,0.94723767921737,"Alphapapillomavirus 11"
0.00749926242556155,11.4785240818061,1.19251279798674,0.278443273070895,0.94723767921737,"Alphapapillomavirus 9"
-0.0846103191916658,2.83831028879845,1.24887039051276,0.267462401103248,0.94723767921737,"Andes orthohantavirus, Orthohantavirus nigrorivense, Orthohantavirus sinnombreense, unclassified Orthohantavirus, Choclo orthohantavirus, Orthohantavirus bayoui"
0.0917682727416023,2.52154912737065,1.13998991843414,0.289201107673405,0.94723767921737,"Andes orthohantavirus, Orthohantavirus sinnombreense, unclassified Orthohantavirus, Orthohantavirus negraense"
0.177081621366363,0.882929456104009,1.13869233339553,0.289473598002576,0.94723767921737,"Andes orthohantavirus, unclassified Orthohantavirus, Orthohantavirus sinnombreense, Choclo orthohantavirus, Orthohantavirus bayoui"
0.00906617031651492,9.84387132589142,1.16778546273484,0.283442724356748,0.94723767921737,"Avastrovirus 2"
-0.18643141953604,1.10313486244551,1.26971642519922,0.263540161196266,0.94723767921737,"Bunyamwera orthobunyavirus, Ilesha orthobunyavirus, Maguari orthobunyavirus, Cache Valley orthobunyavirus"
-0.0199257583683683,6.99547048769313,1.13714398772927,0.289799181951919,0.94723767921737,"Cowpox virus, Ectromelia virus"
0.129421456889398,1.68743844282966,1.52389091287087,0.267172266387743,0.94723767921737,"Cowpox virus, Vaccinia virus, Akhmeta virus"
0.0595274391411682,3.46396880244516,1.45761048019974,0.285655276072335,0.94723767921737,"Deltacoronavirus"
-0.0573408112817608,3.65415120082739,1.16134158381882,0.287796873812574,0.94723767921737,"Dengue virus 2, Dengue virus 3"
-0.0731465179160277,3.56183375827583,1.2228576638266,0.272461024993185,0.94723767921737,"Dengue virus 4, Dengue virus 2"
0.0135932088192328,8.18016538586424,1.20902128420332,0.275168220960293,0.94723767921737,"Eastern equine encephalitis virus"
0.0815500357021402,3.66642205413159,1.16081336523424,0.284873151935365,0.94723767921737,"Enterovirus A, Enterovirus A114 (Strain)"
-0.0911139585236208,2.7488385722196,2.08780972302637,0.275052473277413,0.94723767921737,"Enterovirus B, Echovirus 1 (Strain Farouk / Atcc Vr-1038) (Strain), Enterovirus B107 (Strain)"
0.0923857465186018,7.08182194153788,1.17972202235829,0.281015112536298,0.94723767921737,"Enterovirus B, Echovirus E32 (Strain)"
-0.0463915250519666,5.40107361101002,1.17354090341779,0.282268859006952,0.94723767921737,"Enterovirus B, unclassified Enterovirus, Echovirus E26 (Strain)"
-0.207394887437775,2.77717747743622,1.19311631649295,0.278322669311021,0.94723767921737,"Enterovirus C, Coxsackievirus A1 (Strain), Coxsackievirus A19 (Strain), Enterovirus C116 (Strain), Enterovirus C113 (Strain)"
0.107366623111245,2.10216787691608,1.43169894510219,0.286868916420593,0.94723767921737,"Enterovirus C, Coxsackievirus A17 (Strain), Coxsackievirus A20 (Strain)"
-0.0488990878148968,4.74470494491042,1.1654768763403,0.283915339835659,0.94723767921737,"Enterovirus C, Coxsackievirus A20 (Strain)"
0.0157700049317802,7.86266065908093,1.147347418462,0.287662295523411,0.94723767921737,"Gammapapillomavirus 27"
0.0332911735628113,5.4081737308512,1.58397392954597,0.274901396114859,0.94723767921737,"Gemykibivirus humas3"
0.0177826172522031,7.31527632777233,1.1647842072338,0.284057341075541,0.94723767921737,"Hantaan orthohantavirus, Orthohantavirus hantanense, unclassified Orthohantavirus"
0.0668327870148771,3.26839088892718,1.13923086612024,0.289360466922296,0.94723767921737,"Hendra henipavirus, Henipavirus hendraense"
0.0351369018486287,5.26911363679122,1.17683953795629,0.281598890205751,0.94723767921737,"Human associated cyclovirus 12"
0.0357498279886119,5.43688817768596,1.18793372117301,0.279360511223756,0.94723767921737,"Human associated cyclovirus 4"
-0.0260740630206265,9.64568639474956,1.25516660189472,0.266270022122965,0.94723767921737,"Human betaherpesvirus 6B (Human herpesvirus 6B; HHV-6B), unclassified Human betaherpesvirus 6 (Human herpesvirus 6; HHV-6)"
0.0154164069784121,8.29766343144732,1.26903088705592,0.263667987777983,0.94723767921737,"Human betaretrovirus"
0.0164527249577751,8.03301670986245,1.18848442235708,0.279249995574897,0.94723767921737,"Human bocavirus"
-0.0158109782443212,9.90541592780284,1.24291215328745,0.268597004384683,0.94723767921737,"Human coronavirus OC43, Bovine coronavirus, Betacoronavirus 1"
0.0162294296138151,7.58543137371751,1.1989736718879,0.277155629570376,0.94723767921737,"Human cosavirus E1"
0.0662373141593695,3.54181870534039,1.14323399133706,0.288521307074473,0.94723767921737,"Human immunodeficiency virus 1 (HIV-1), HIV-1 M:B (subtype), unclassified Primate lentivirus group"
0.138070154139901,1.63744456295186,1.2471257626228,0.267793994251133,0.94723767921737,"Human immunodeficiency virus 1 (HIV-1), HIV-1 M:C (subtype), HIV-1 M:F (subtype), HIV-1 M:J (subtype)"
0.0718921417375175,5.14891464780978,1.17826912489379,0.281309167701599,0.94723767921737,"Human immunodeficiency virus 1 (HIV-1), HIV-1 M:H (subtype), HIV-1 M:C (subtype), HIV-1 M:F (subtype), HIV-1 M:K (subtype), HIV-1 M:G (subtype), HIV-1 M:B (subtype), HIV-1 M:J (subtype)"
0.119100900230156,1.68508910067595,1.14421542614024,0.288316052527836,0.94723767921737,"Human immunodeficiency virus 1 (HIV-1), HIV-1 M:H (subtype), HIV-1 M:C (subtype), HIV-1 M:F (subtype), HIV-1 M:K (subtype), HIV-1 M:G (subtype), HIV-1 M:J (subtype)"
-0.080473565214057,2.85207387451631,1.17924853737313,0.281110898916601,0.94723767921737,"Human mastadenovirus D, Human mastadenovirus G"
-0.178134009448399,1.64039558987001,1.26662899521965,0.264116465974896,0.94723767921737,"Influenza A virus, Influenza A virus H1N1 (subtype), Influenza A virus H7N9 (subtype), Influenza A virus H9N2 (subtype), Influenza A virus H3N2 (subtype), Influenza A virus H5N1 (subtype)"
0.110543287671297,1.98594184301756,1.40994917745884,0.279887875155413,0.94723767921737,"Influenza A virus, Influenza A virus H3N2 (subtype), Influenza A virus H9N2 (subtype)"
-0.0865648024896158,2.77854023763441,1.26707268614995,0.280415519929831,0.94723767921737,"Keystone orthobunyavirus, Melao orthobunyavirus"
-0.0169807056225809,7.44716516065794,1.15827108120744,0.285397048248045,0.94723767921737,"Lyssavirus hamburg, Lyssavirus helsinki"
-0.104716795757498,2.10951655125148,1.2567472947715,0.265971726097053,0.94723767921737,"Lyssavirus hamburg, Lyssavirus lagos"
0.101239142773566,2.38977343484455,1.33862941784807,0.287385700075783,0.94723767921737,"Lyssavirus hamburg, Lyssavirus rabies, Lyssavirus helsinki"
0.0196673346524507,6.96286148029386,1.2557196587012,0.266165605484137,0.94723767921737,"Madrid orthobunyavirus"
0.0124281956714608,8.74956410220891,1.17271008896879,0.282437923858804,0.94723767921737,"Mammarenavirus brazilense"
0.0608399552068094,10.9351363530444,1.16338244381971,0.284344990310116,0.94723767921737,"Measles morbillivirus"
0.0574626405902849,4.04836588072117,1.69131789767552,0.271522402354852,0.94723767921737,"Monkeypox virus, Akhmeta virus, unclassified Orthopoxvirus, Vaccinia virus"
0.01385704703159,8.21027284050908,1.17682670281187,0.281601493130672,0.94723767921737,"Monkeypox virus, Cowpox virus"
0.0194584456786111,7.17105609606714,1.2066888062846,0.275627958375071,0.94723767921737,"Monkeypox virus, Cowpox virus, Akhmeta virus, Vaccinia virus"
0.0263820020704087,5.9130809084378,1.20800286805675,0.275368833064385,0.94723767921737,"Monkeypox virus, unclassified Orthopoxvirus, Vaccinia virus"
0.123694510285982,1.66824539381955,1.40401620033886,0.280744199313526,0.94723767921737,"Monkeypox virus, Variola virus, Akhmeta virus, Ectromelia virus"
-0.0362406495483861,5.46203088001771,1.2364580902178,0.269832915292297,0.94723767921737,"Monkeypox virus, Variola virus, Cowpox virus, Akhmeta virus, unclassified Orthopoxvirus, Vaccinia virus"
0.0194741992432331,7.85546842973712,1.20870952985135,0.275229611913453,0.94723767921737,"Onyong-nyong virus"
0.0522002586227432,4.29832819856257,1.27795190545751,0.262010648418287,0.94723767921737,"Puumala orthohantavirus, Orthohantavirus puumalaense, Orthohantavirus tulaense"
0.0101766150966062,10.5865411278608,1.23403090599593,0.270299570750988,0.94723767921737,"Renitovirus"
-0.104787312376385,7.64699648227422,1.17938281077988,0.28108373105097,0.94723767921737,"Rhinovirus A, Human Rhinovirus A44 (Strain)"
-0.108322969304808,8.50738447187279,1.23611447100845,0.269898918093441,0.94723767921737,"Rhinovirus A, Rhinovirus A2 (Strain)"
-0.103492601508756,2.521220343924,1.22725186582947,0.271608360102848,0.94723767921737,"Rhinovirus A, Rhinovirus A65 (Strain), Rhinovirus A103 (Strain)"
-0.245684913499514,5.35572801485358,1.25435325424515,0.26642367554416,0.94723767921737,"Rhinovirus A, Rhinovirus A73 (Strain)"
-0.142680052869706,1.60777630945596,1.19616173797242,0.277715106985909,0.94723767921737,"Rhinovirus A, Rhinovirus A8 (Strain)"
-0.145663820477394,2.68879977175953,1.14683155282386,0.287769843145004,0.94723767921737,"Rhinovirus A, unclassified Rhinovirus, Rhinovirus A1 (Strain)"
-0.176286263534917,5.42108088674379,1.14775760692334,0.287576816476941,0.94723767921737,"Rhinovirus A, unclassified Rhinovirus, Rhinovirus A21 (Strain)"
-0.187227675311325,5.25397141068436,1.24337569292489,0.268508515981217,0.94723767921737,"Rhinovirus B, Rhinovirus B37 (Strain), Rhinovirus B103 (Strain)"
-0.0626048602942263,8.07218210475464,1.27424861216863,0.262697044838571,0.94723767921737,"Rhinovirus B, Rhinovirus B4 (Strain)"
-0.0755561370288448,2.75425321571403,1.34028935411446,0.277518589356816,0.94723767921737,"Rhinovirus B, Rhinovirus B93 (Strain), Rhinovirus B84 (Strain)"
-0.0711181879527494,7.59201812590578,1.15463132690573,0.286149264802503,0.94723767921737,"Rhinovirus C, Rhinovirus C_AET72469.1 (Strain)"
-0.0594175628508677,7.51893164117985,1.15221978651247,0.286649057252093,0.94723767921737,"Rhinovirus C, Rhinovirus C33 (Strain)"
-0.0775054165536598,7.82322275276308,1.27566238863857,0.262434737794633,0.94723767921737,"Rhinovirus C, Rhinovirus C55 (Strain)"
-0.0930590831679336,7.96013875848618,1.16050847305233,0.284935916659999,0.94723767921737,"Rhinovirus C, Rhinovirus C9 (Strain)"
0.035699972976909,5.12720889351499,1.15174135129914,0.286748346790623,0.94723767921737,"Rift Valley fever phlebovirus, Phlebovirus riftense"
0.0133608302245879,8.84845006621329,1.17454632909763,0.282064435661168,0.94723767921737,"Sosuga pararubulavirus"
-0.0501606934001431,5.89511915710597,1.14688990947592,0.287757674353374,0.94723767921737,"Torque teno mini virus 8"
0.0129889916494673,8.79769236918851,1.21509599698621,0.27397545805583,0.94723767921737,"Turlock orthobunyavirus"
0.05676640907714,4.74310446019291,1.27455335132474,0.262640476704383,0.94723767921737,"unclassified Enterovirus, Enterovirus C116 (Strain)"
-0.0256431392311719,6.30056623038012,1.26452315628796,0.26451045764037,0.94723767921737,"unclassified Mamastrovirus, Mamastrovirus 8"
-0.0729604979468354,4.00518526675678,1.13970373594634,0.289261176938464,0.94723767921737,"unclassified Orthohantavirus, Orthohantavirus sinnombreense, Orthohantavirus puumalaense"
0.0803200532887818,2.75764546506337,1.17088116333165,0.287904925221599,0.94723767921737,"Vaccinia virus, Variola virus, Akhmeta virus"
-0.0894285680860504,2.26376717795654,1.17250149366055,0.28248039193773,0.94723767921737,"Variola virus, Camelpox virus, Cowpox virus, Akhmeta virus"
0.0835558286156786,3.01393301137535,1.26776751617429,0.263903762925659,0.94723767921737,"Variola virus, Vaccinia virus, Cowpox virus, unclassified Orthopoxvirus"
0.0268367557977763,6.75909342636554,1.22202883595278,0.272622234659222,0.94723767921737,"Vesicular exanthema of swine virus"
0.0150004537110725,8.30184219229982,1.13879594947501,0.289451826641571,0.94723767921737,"Vesiculovirus jurona"
0.0296080530883757,4.63951107611251,0.674063763889275,0.463591425197723,0.948186298169041,"Adeno-associated dependoparvovirus A"
0.0113529652748353,9.29051785950247,1.04734194667324,0.309526849925157,0.948186298169041,"Aichivirus A"
0.00633275939261899,10.9789538227219,0.605121713113446,0.439164776165442,0.948186298169041,"Akhmeta virus"
