"logFC","logCPM","F","PValue","FDR","Species"
0.0476986912933275,8.36390136332611,16.8759814043083,0.000103739649634508,0.0537786343705287,"Aichivirus B"
-1.25424105451039,1.54871258455867,17.2058758855845,9.01438136944575e-05,0.0537786343705287,"Enterovirus A, Coxsackievirus A16 (Strain), Enterovirus A114 (Strain)"
-1.23145803792456,2.28510279102596,19.0685956082225,4.12611909137361e-05,0.0537786343705287,"Enterovirus A, Enterovirus A71 (Strain), Coxsackievirus A6 (Strain)"
-1.03498938231101,2.26550490862363,16.9587223265382,0.000100142147966893,0.0537786343705287,"Enterovirus B, Coxsackievirus B1 (Strain), Echovirus E30 (Strain), Echovirus E33 (Strain), Enterovirus B81 (Strain), Enterovirus B85 (Strain), Enterovirus B87 (Strain), Enterovirus B88 (Strain), Enterovirus B100 (Strain), Enterovirus B111 (Strain)"
-1.41733795365844,1.812020564723,17.9304433902969,6.63597792850486e-05,0.0537786343705287,"Enterovirus B, Echovirus E13 (Strain), Enterovirus B98 (Strain)"
-0.957277556295493,2.21076392569549,14.8828067987325,0.000245855993198163,0.0910369620528053,"Enterovirus A, Coxsackievirus A5 (Strain), Coxsackievirus A7 (Strain), Coxsackievirus A10 (Strain), Coxsackievirus A2 (Strain)"
-1.2194328511441,2.5749935866292,15.064902762025,0.000226983139484824,0.0910369620528053,"Enterovirus B, Echovirus E15 (Strain), Echovirus E17 (Strain), Echovirus E19 (Strain), Echovirus E2 (Strain), Echovirus E21 (Strain), Echovirus E29 (Strain), Echovirus E33 (Strain), Enterovirus B81 (Strain), Enterovirus B83 (Strain), Enterovirus B111 (Strain), Enterovirus B106 (Strain), Coxsackievirus A9 (Strain), Enterovirus B98 (Strain)"
-1.06364342483483,2.73963751751137,13.7324074232412,0.000409289293959444,0.13260973124286,"Enterovirus B, Coxsackievirus B3 (Strain), Echovirus E14 (Strain), Echovirus E25 (Strain)"
-1.11248085299664,2.10720454888963,13.2291597456423,0.000512982235133009,0.147738883718307,"Enterovirus B, Echovirus E16 (Strain), Echovirus E24 (Strain)"
-0.689068209057335,1.62931664481564,12.5646842057204,0.000693113769292231,0.179655089000546,"Enterovirus C, Coxsackievirus A11 (Strain), Enterovirus C102 (Strain)"
-0.474398015065892,3.89915257442251,12.1820057670804,0.000825510923257066,0.194520392098392,"Enterovirus B, Coxsackievirus B4 (Strain)"
-0.360279806424598,6.0503545862409,11.9320363302942,0.000925924228713837,0.199999633402189,"unclassified Enterovirus, Enterovirus B112 (Strain)"
-1.05528792825243,2.70202931937309,11.7152489997288,0.0010232489711785,0.204020102561129,"Enterovirus C, unclassified Enterovirus, Coxsackievirus A11 (Strain), Coxsackievirus A13 (Strain), Coxsackievirus A17 (Strain), Coxsackievirus A21 (Strain), Human Poliovirus 1 Mahoney (Strain)"
-0.239603323489845,2.67480036119729,11.6165975519491,0.00118937500469256,0.220204286583079,"Enterovirus B, unclassified Enterovirus, Enterovirus B98 (Strain), Enterovirus B77 (Strain)"
-0.118897360993885,6.80084164429995,11.0399643266239,0.00140034349885084,0.227203131852429,"Enterovirus A, Coxsackievirus A8 (Strain)"
-0.422644997350984,4.04666503732843,10.9071281582212,0.00149014399748892,0.227203131852429,"Enterovirus B, Enterovirus B97 (Strain)"
-0.629465941419546,3.15268300321464,11.0216894951928,0.00141235677634282,0.227203131852429,"Rhinovirus A, Rhinovirus A23 (Strain)"
0.0355333997782295,8.21341953239921,10.3441861726748,0.00194243415454911,0.251739466429565,"Echarate phlebovirus"
-0.99754850778182,1.72782573277095,10.3966505241366,0.00189481757328988,0.251739466429565,"Enterovirus B, unclassified Enterovirus, Coxsackievirus B3 (Strain), Echovirus E15 (Strain), Echovirus E17 (Strain), Echovirus E19 (Strain), Echovirus E2 (Strain), Echovirus E21 (Strain), Echovirus E24 (Strain), Echovirus E25 (Strain), Echovirus E29 (Strain), Echovirus E33 (Strain), Enterovirus B79 (Strain), Enterovirus B81 (Strain), Enterovirus B83 (Strain), Enterovirus B111 (Strain), Enterovirus B106 (Strain), Coxsackievirus A9 (Strain)"
-0.432531118829053,5.96500340405107,10.5140503685432,0.00179260755371511,0.251739466429565,"Mamastrovirus 6, unclassified Mamastrovirus"
0.131260785347571,4.42641318136264,10.3201729295557,0.00206108390343139,0.25439664179496,"Oropouche orthobunyavirus, Orthobunyavirus oropoucheense"
-0.142099423737529,6.39478181908228,9.51058212490682,0.00289104726869325,0.312233105018871,"Enterovirus A, Coxsackievirus A5 (Strain)"
-0.710208601763607,2.2922495793183,9.66643102795563,0.00268259388377873,0.312233105018871,"Enterovirus B, Echovirus E6 (Strain), Enterovirus B84 (Strain)"
-0.232376686846767,2.70332010602922,9.53295984943028,0.00286010839551274,0.312233105018871,"Enterovirus C, unclassified Enterovirus, Poliovirus 2_CAA25246.1 (Strain)"
-1.03440321684498,3.25464109650178,9.30900072613114,0.00318596488408252,0.325271241219385,"Enterovirus A, Coxsackievirus A5 (Strain), Enterovirus A120 (Strain)"
0.424329728993928,1.18205332716692,9.85406731575893,0.00336858603377653,0.325271241219385,"Enterovirus B, Coxsackievirus B3 (Strain), Echovirus 1 (Strain Farouk / Atcc Vr-1038) (Strain), Coxsackievirus B6 (Strain), Echovirus E14 (Strain), Echovirus E2 (Strain), Echovirus E20 (Strain), Echovirus E24 (Strain), Echovirus E26 (Strain), Echovirus E3 (Strain), Echovirus E32 (Strain), Echovirus E4 (Strain), Echovirus E6 (Strain), Enterovirus B75 (Strain), Enterovirus B79 (Strain), Enterovirus B82 (Strain), Enterovirus B85 (Strain), Enterovirus B101 (Strain), Enterovirus B93 (Strain), Enterovirus B113 (Strain), Enterovirus B106 (Strain), Coxsackievirus A9 (Strain), Enterovirus B98 (Strain), Enterovirus B107 (Strain)"
-0.132213807722529,4.13836652307431,9.18167642183693,0.00338824209603526,0.325271241219385,"Influenza A virus, Influenza A virus H3N2 (subtype), Influenza A virus H1N2 (subtype)"
-0.257997395481558,6.24630324929413,8.91862711956345,0.00384968039927537,0.356370414104349,"Mamastrovirus 1, unclassified Mamastrovirus"
-0.302232270125023,5.49826681495827,8.4373045691836,0.00487165154714555,0.432783233133027,"Human orthorubulavirus 4"
0.544907886531692,2.21027633813502,8.38076380576034,0.00500906519829892,0.432783233133027,"Rhinovirus A, Rhinovirus A24 (Strain), Rhinovirus A90 (Strain)"
-0.493995093067345,2.42521889031832,7.74720412111599,0.00685742873429965,0.573369525138861,"Enterovirus C, Poliovirus 2_AAA46912.1 (Strain), Poliovirus 3_AAA46914.1 (Strain), Coxsackievirus A11 (Strain), Coxsackievirus A17 (Strain), Coxsackievirus A20 (Strain), Enterovirus C102 (Strain), Human Poliovirus 1 Mahoney (Strain), Human Poliovirus 1 Strain Sabin (Strain), Poliovirus 2_CAA25246.1 (Strain), Poliovirus 3_CAA25444.1 (Strain)"
-0.631899236791389,4.49120537896683,7.6819939968038,0.00708455569030137,0.573849010914411,"Rhinovirus A, Rhinovirus A32 (Strain)"
-0.242002497806243,2.30016558286793,7.60640077786273,0.00735773484596177,0.577916627900997,"Influenza A virus, Influenza A virus H5N1 (subtype), Influenza A virus H1N1 (subtype), Influenza A virus H3N2 (subtype), Influenza A virus H7N7 (subtype), Influenza A virus H9N2 (subtype), Influenza A virus with incomplete names (subtype), Influenza A virus mixed subtypes (subtype)"
-0.318867991143644,3.19927505382942,7.52448357500769,0.0076662552391495,0.584439222937515,"Rhinovirus B, Rhinovirus B14 (Strain), Rhinovirus B6 (Strain), Rhinovirus B35 (Strain), Rhinovirus B3 (Strain), Rhinovirus B37 (Strain), Rhinovirus B52_ABO69380.1 (Strain), Rhinovirus B52_ACK37393.1 (Strain), Rhinovirus B79 (Strain), Rhinovirus B83 (Strain), Rhinovirus B92 (Strain), Rhinovirus B103 (Strain)"
-0.0978059787777919,12.3633779927588,7.29351001626948,0.00861133727175808,0.620016283566582,"Human alphaherpesvirus 3 (Varicella zoster virus; VZV)"
0.114369092828329,4.28749237505043,7.30832306355962,0.00854720736531703,0.620016283566582,"Vaccinia virus, unclassified Orthopoxvirus"
0.0265293972006707,8.79958216990967,7.1403092534028,0.00930496071140385,0.651850220647535,"Gammapapillomavirus 2"
0.188993134030175,2.75635629460325,7.35989475132976,0.0097419015215462,0.664500230101256,"Monkeypox virus, Cowpox virus, Akhmeta virus, Vaccinia virus, Variola virus, Ectromelia virus"
0.252590322483609,2.22601617416862,6.98417070324657,0.0100724593469176,0.669431144287444,"Rhinovirus B, Rhinovirus B17 (Strain), Rhinovirus B91 (Strain)"
0.04782647176962,7.09050843021801,6.76378429335473,0.0112707470210951,0.671947373358565,"Bunyamwera orthobunyavirus, Batai orthobunyavirus"
0.262606095036956,2.55463497648997,6.89724935213934,0.010528252634095,0.671947373358565,"Enterovirus A, Enterovirus C, unclassified Enterovirus, Coxsackievirus A16 (Strain), Coxsackievirus A7 (Strain)"
-0.212397616568788,4.16626984119496,6.74038140270475,0.0114065140539263,0.671947373358565,"Enterovirus A, unclassified Enterovirus, Coxsackievirus A8 (Strain)"
0.264935843348879,2.05102180123394,6.81782600863848,0.0109636824510582,0.671947373358565,"Rhinovirus A, unclassified Enterovirus, Rhinovirus C, Rhinovirus A16 (Strain), Rhinovirus A15 (Strain), Rhinovirus A38 (Strain), Rhinovirus A59 (Strain), Rhinovirus A76 (Strain), Rhinovirus A82 (Strain), Rhinovirus A11 (Strain), Rhinovirus A64 (Strain), Rhinovirus A19 (Strain), Rhinovirus A22 (Strain), Rhinovirus A32 (Strain), Rhinovirus A33 (Strain), Rhinovirus A40 (Strain), Rhinovirus A43 (Strain), Rhinovirus A54 (Strain), Rhinovirus A56 (Strain), Rhinovirus A60 (Strain), Rhinovirus A66 (Strain), Rhinovirus A81 (Strain), Rhinovirus A85 (Strain), Rhinovirus A90 (Strain), Rhinovirus A9 (Strain), Rhinovirus A_AEP69150.1 (Strain)"
0.387107909115377,1.07514418742237,7.5180063746992,0.0110458449212306,0.671947373358565,"Rhinovirus B, Rhinovirus B6 (Strain), Rhinovirus B37 (Strain)"
-0.063223747842898,9.37477379800056,6.52145476146555,0.0127630698551904,0.694218548325443,"Human coronavirus OC43"
0.332494746981526,1.33850854416707,7.41648146854069,0.0120970328499606,0.694218548325443,"La Crosse orthobunyavirus, Tahyna orthobunyavirus"
-0.550146833073661,2.26544058850073,6.54080542336799,0.0126365962902423,0.694218548325443,"Rhinovirus A, Rhinovirus A33 (Strain)"
-0.541908511510798,2.47232423231797,6.50737971004244,0.0128558990430638,0.694218548325443,"Rhinovirus C, unclassified Rhinovirus, Rhinovirus C15 (Strain)"
0.204750182462381,2.71262300145801,6.40671699250832,0.0135408689785704,0.716284334539888,"Enterovirus C, Coxsackievirus A22 (Strain), Enterovirus C96 (Strain)"
-0.194534848947353,3.00460419137722,6.34237857570781,0.0139987111207405,0.725693184499187,"Vaccinia virus, Akhmeta virus, Ectromelia virus"
-0.228188400251855,2.41575399115704,6.30068611398014,0.014304085972334,0.726984134123328,"Human mastadenovirus C, Human mastadenovirus E, Human mastadenovirus F, unclassified Mastadenovirus, Human mastadenovirus G"
-0.186971037165664,2.71115465341466,6.1208628124379,0.0157039228533046,0.735660384105638,"Influenza A virus, Influenza A virus H3N2 (subtype), Influenza A virus H5N1 (subtype), Influenza A virus H2N2 (subtype), Influenza A virus H1N1 (subtype), Influenza A virus H9N2 (subtype), Influenza A virus mixed subtypes (subtype), Influenza A virus H7N7 (subtype), Influenza A virus with incomplete names (subtype)"
-0.208085873250947,2.42109439045493,6.4699082910394,0.0162845349989206,0.735660384105638,"Orthohantavirus seoulense, unclassified Orthohantavirus, Orthohantavirus hantanense"
-0.273208106195809,7.59388483677513,6.03046437620119,0.0164615363727342,0.735660384105638,"Rhinovirus A, Rhinovirus A20 (Strain)"
-0.364270612461558,5.95093888384662,6.09113728515031,0.0159489036598295,0.735660384105638,"Rhinovirus B, Rhinovirus B26 (Strain)"
-0.362985004872731,3.60524580415859,6.15964772192225,0.015390232724385,0.735660384105638,"Rosavirus A"
0.218836097075795,2.39387024806497,6.99108087270907,0.0152685699295043,0.735660384105638,"unclassified Human adenoviruses, Human mastadenovirus D, Human mastadenovirus F, Human mastadenovirus B"
0.22335537974328,2.13420808793621,7.09200425544086,0.0151537337441397,0.735660384105638,"Variola virus, Akhmeta virus, Vaccinia virus"
0.0622509940589807,6.24848271931864,5.94198677444232,0.0172404950900459,0.744789387889984,"La Crosse orthobunyavirus, Snowshoe hare orthobunyavirus"
-0.216499424719564,2.22064220770365,6.3867724527432,0.0171611080334503,0.744789387889984,"Monkeypox virus, Variola virus, Akhmeta virus, Camelpox virus, Cowpox virus"
0.412455691850883,2.5324592581233,5.88937075237056,0.0177221044939666,0.7507846819078,"Enterovirus A, unclassified Enterovirus, Coxsackievirus A16 (Strain), Coxsackievirus A6 (Strain), Coxsackievirus A7 (Strain), Coxsackievirus A12 (Strain), Coxsackievirus A14 (Strain), Enterovirus A114 (Strain), Coxsackievirus A2 (Strain)"
0.127573536287811,3.97242615189409,5.85913496231525,0.0180052740300527,0.7507846819078,"Influenza A virus, Influenza A virus H7N2 (subtype)"
0.037845950604247,7.30391602906636,6.29277688192014,0.0182482387963701,0.7507846819078,"unclassified Rotavirus, Rotavirus H"
0.0276293112117482,10.4255941901351,5.79891526008286,0.018583597188958,0.752635686152801,"Porcine circovirus 2"
0.303111559536294,1.4075320838801,5.96030107000385,0.0189995470012619,0.757643474265704,"Human alphaherpesvirus 2 (Herpes simplex virus 2; HHV-2; HSV-2), Papiine alphaherpesvirus 2"
-0.39730481204091,4.27085064840168,5.61457036374848,0.0204793578167622,0.773070530562376,"Enterovirus A, unclassified Enterovirus, Coxsackievirus A16 (Strain), Enterovirus A114 (Strain)"
0.319056930458361,2.48406024244621,5.64225008596687,0.0201821168615318,0.773070530562376,"Enterovirus C, unclassified Enterovirus, Poliovirus 2_AAA46912.1 (Strain), Poliovirus 3_AAA46914.1 (Strain), Coxsackievirus A11 (Strain), Coxsackievirus A13 (Strain), Coxsackievirus A17 (Strain), Coxsackievirus A20 (Strain), Enterovirus C99 (Strain), Human Poliovirus 1 Mahoney (Strain), Poliovirus 2_CAA25246.1 (Strain), Poliovirus 3_CAA25444.1 (Strain)"
0.0812048000559507,5.18602230021462,5.55991532774606,0.0210799727743313,0.773070530562376,"Human associated cyclovirus 2"
0.283971598087976,1.49384662966872,6.4485723524974,0.0220054083390269,0.773070530562376,"Human bocavirus 1, Bocaparvovirus primate1"
-0.227303534607181,1.92984683470322,5.70864107130291,0.0220706864435246,0.773070530562376,"Human mastadenovirus C, Human mastadenovirus G"
0.0438493866019598,6.8243352677461,5.51534272437314,0.0215835985059447,0.773070530562376,"Madariaga virus, Eastern equine encephalitis virus"
-0.194751868347031,7.16668261089051,5.54036379723267,0.0212993353666593,0.773070530562376,"Rhinovirus A, Rhinovirus A46 (Strain)"
-0.544087383982962,3.48500091748332,5.47438759532297,0.0220575977696253,0.773070530562376,"Rhinovirus B, Rhinovirus B14 (Strain), Rhinovirus B35 (Strain), Rhinovirus B3 (Strain), Rhinovirus B72 (Strain), Rhinovirus B79 (Strain), Rhinovirus B83 (Strain), Rhinovirus B86 (Strain), Rhinovirus B101 (Strain), Rhinovirus B102 (Strain)"
-0.089833023393044,4.53499616750514,6.24798187128334,0.0205198217808361,0.773070530562376,"unclassified Orthohantavirus, Choclo orthohantavirus"
-0.0422635174851238,7.05299327477947,5.43768580198402,0.0224917495209368,0.777314863443576,"Pegivirus A, Pegivirus C"
0.0255900780821859,8.53191492089393,5.23722240932253,0.0250286149040368,0.791862030948892,"Ekpoma virus 1"
-0.213532171465267,2.94496244461819,5.1684382890933,0.0259676977741728,0.791862030948892,"Enterovirus B, unclassified Enterovirus, Coxsackievirus B1 (Strain), Coxsackievirus B2 (Strain), Echovirus E18 (Strain), Enterovirus B69 (Strain), Coxsackievirus A9 (Strain)"
0.188438220067532,2.57329450229715,7.18523887736478,0.0250395698411896,0.791862030948892,"Human immunodeficiency virus 1 (HIV-1), HIV-1 M:B (subtype), HIV-1 M:F (subtype), unclassified Primate lentivirus group"
-0.142668381891918,3.34848610948966,5.28378885708158,0.0244133852859461,0.791862030948892,"Human immunodeficiency virus 1 (HIV-1), HIV-1 M:C (subtype), HIV-1 M:G (subtype)"
0.34357118257759,0.998454678313415,7.67407068776254,0.0256877158605996,0.791862030948892,"Human immunodeficiency virus 1 (HIV-1), HIV-1 M:F (subtype), HIV-1 M:K (subtype), HIV-1 M:B (subtype), HIV-1 M:J (subtype)"
0.0504215976448641,8.93958568690298,5.21771156148293,0.0252912660737218,0.791862030948892,"Influenza A virus, Influenza A virus H5N1 (subtype)"
-0.0754475042839237,5.25101030871206,6.48646453415348,0.0247920736310908,0.791862030948892,"Oriboca orthobunyavirus, Marituba orthobunyavirus, unclassified Orthobunyavirus"
0.368292027924791,1.20485970102399,5.3655087793738,0.0233721970524011,0.791862030948892,"Orthohantavirus dobravaense, Orthohantavirus hantanense, Orthohantavirus seoulense"
0.220863960970772,2.05725994036122,5.35035446856811,0.0235616583422499,0.791862030948892,"Rhinovirus A, Rhinovirus A1 (Strain), Rhinovirus A81 (Strain)"
-0.3787087851801,2.71229394111343,5.19665359040796,0.0255780334761198,0.791862030948892,"Rhinovirus C, unclassified Rhinovirus, Rhinovirus C7 (Strain)"
-0.614200495909741,1.72066800857746,5.1426042460954,0.0263300123229574,0.793574324896576,"Enterovirus C, Coxsackievirus A19 (Strain), Enterovirus C96 (Strain), Enterovirus C116 (Strain), Enterovirus C113 (Strain)"
-0.539294528500786,1.36969592488542,5.07223092366849,0.0273445154913429,0.805420274472281,"Enterovirus B, unclassified Enterovirus, Enterovirus B73 (Strain), Echovirus E29 (Strain)"
0.0204499003583634,13.8411443089004,5.08801301785665,0.0271134379354777,0.805420274472281,"Influenza A virus"
0.0179410731084692,10.1634297938401,4.46300244658487,0.0380850605277316,0.806679195506207,"Alphapapillomavirus 5"
0.117655024425497,3.44986236525998,3.79619507344378,0.0552447284590209,0.806679195506207,"Andes orthohantavirus, unclassified Orthohantavirus, Choclo orthohantavirus, Orthohantavirus negraense"
0.0221169866058918,8.64030282631783,4.05876895227969,0.0476567148368947,0.806679195506207,"Argentinian mammarenavirus"
0.0263061872614798,8.38098715025371,3.7976522879226,0.0551991753431102,0.806679195506207,"Aura virus"
0.0253814252037396,10.8723386620608,4.45435161546723,0.038266753978794,0.806679195506207,"Banna virus"
0.130497205639788,3.21585718161144,4.27440561896699,0.0422648855571534,0.806679195506207,"Cache Valley orthobunyavirus, Maguari orthobunyavirus"
-0.242066559127311,1.64693374919081,4.75945948751141,0.0353670842383557,0.806679195506207,"Chikungunya virus, Semliki Forest virus, Getah virus, Middelburg virus, Onyong-nyong virus, Ross River virus"
-0.0247903826457267,8.7246927550549,3.97189604877026,0.0500344759113688,0.806679195506207,"Cosavirus F"
-0.289043170134886,1.15630685341544,4.83018030358106,0.0437184141593855,0.806679195506207,"Cowpox virus, Monkeypox virus, unclassified Orthopoxvirus"
0.262603211085489,1.30004816116239,4.36603881435557,0.0546841716017083,0.806679195506207,"Cowpox virus, Monkeypox virus, Vaccinia virus, Ectromelia virus"
0.107083684102271,3.6331141362888,4.36330834634832,0.0404167692319992,0.806679195506207,"Cowpox virus, Vaccinia virus, Monkeypox virus"
0.0229219331111914,8.94410399715108,4.73080098281845,0.032893426158317,0.806679195506207,"Crimean-Congo hemorrhagic fever orthonairovirus, Orthonairovirus haemorrhagiae"
0.036649244765619,7.1544680011534,3.90135594477087,0.0520594776678666,0.806679195506207,"Dugbe orthonairovirus, Orthonairovirus dugbeense"
-0.0510019968735836,6.38675857148028,3.94010812380521,0.0509362772897729,0.806679195506207,"Eastern chimpanzee simian foamy virus"
-0.156069307201055,4.41457627906366,4.33347632991473,0.0409051061546691,0.806679195506207,"Enterovirus B, Coxsackievirus B1 (Strain)"
-0.231923512445975,2.06901354502203,4.56314457310461,0.0360477545563694,0.806679195506207,"Enterovirus B, Echovirus 1 (Strain Farouk / Atcc Vr-1038) (Strain), Enterovirus B84 (Strain), Enterovirus B93 (Strain), Echovirus E12 (Strain)"
-0.225669847187373,5.27310256040008,4.07978348271322,0.0471000339986794,0.806679195506207,"Enterovirus B, Echovirus E7 (Strain)"
-0.26887224318275,5.28076997211721,4.50734497785027,0.0371681343659557,0.806679195506207,"Enterovirus B, Enterovirus B101 (Strain)"
0.180871203826524,4.13466176796857,5.01405708050521,0.0282145491956665,0.806679195506207,"Enterovirus B, Enterovirus B87 (Strain)"
-0.148658286262684,5.75845688708329,4.53683201218839,0.0365715020776339,0.806679195506207,"Enterovirus B, unclassified Enterovirus, Coxsackievirus A9 (Strain)"
0.193169675141066,2.0588505853266,3.78799945386739,0.0555016867913131,0.806679195506207,"Enterovirus B, unclassified Enterovirus, Coxsackievirus B1 (Strain), Echovirus E30 (Strain), Coxsackievirus B5 (Strain), Echovirus E18 (Strain), Echovirus E15 (Strain), Echovirus E21 (Strain), Echovirus E4 (Strain), Enterovirus B74 (Strain), Enterovirus B85 (Strain), Enterovirus B86 (Strain), Enterovirus B87 (Strain), Enterovirus B88 (Strain), Enterovirus B97 (Strain), Enterovirus B100 (Strain), Enterovirus B111 (Strain), Coxsackievirus A9 (Strain), Enterovirus B98 (Strain), Enterovirus B107 (Strain), Echovirus 9 Strain Hill (Strain)"
0.241131626394405,1.82718150640953,4.44325106037664,0.0385012611321803,0.806679195506207,"Enterovirus C, Coxsackievirus A11 (Strain), Human Poliovirus 1 Mahoney (Strain), Human Poliovirus 1 Strain Sabin (Strain)"
-0.127717687773595,7.77101699206489,3.91810930248148,0.0515706438313562,0.806679195506207,"Enterovirus C, Enterovirus C104 (Strain)"
-0.0531787524019027,8.04530551265922,4.1944945785788,0.0441822506528522,0.806679195506207,"Enterovirus D"
-0.0555903085835059,7.25605483027181,4.69603575752343,0.033522394578986,0.806679195506207,"Enterovirus D, Enterovirus D94 (Strain)"
-0.0910956762086676,4.35416146349105,3.89483774970686,0.0522510191029269,0.806679195506207,"Enterovirus D, Enterovirus D94 (Strain), Enterovirus D111 (Strain)"
-0.0845933375998619,4.39542745205882,3.85848844987003,0.0533332411978959,0.806679195506207,"Enterovirus D, unclassified Enterovirus, Enterovirus D70 (Strain)"
-0.0792669131798297,7.55093030273001,4.63700748292582,0.0346199504384579,0.806679195506207,"Enterovirus G"
0.0365031719138304,6.7372979545229,3.96545881344305,0.0531309129010964,0.806679195506207,"Fort Sherman orthobunyavirus"
0.0189790484150809,10.0649277981499,3.9697874812193,0.0500937573084932,0.806679195506207,"Gammapapillomavirus 10"
-0.0821650057515827,5.09100591304957,3.82069953411646,0.0544840941299533,0.806679195506207,"Henipavirus hendraense"
-0.211306106892566,1.81600823434431,4.81285134205155,0.0510591703686524,0.806679195506207,"Human alphaherpesvirus 1 (Herpes simplex virus 1; HHV-1; HSV-1), Human alphaherpesvirus 2 (Herpes simplex virus 2; HHV-2; HSV-2), Papiine alphaherpesvirus 2, Human alphaherpesvirus 1, Human alphaherpesvirus 2, Macacine alphaherpesvirus 1"
0.0231868153670508,10.6450066408679,4.31322760121754,0.0413658529385676,0.806679195506207,"Human hepatitis A virus"
0.181317718349645,2.34533018199764,4.56672280758598,0.035977152784948,0.806679195506207,"Human immunodeficiency virus 1 (HIV-1), HIV-1 M:K (subtype), HIV-1 M:B (subtype), HIV-1 M:F (subtype), HIV-1 M:J (subtype), HIV-1 N_Y (subtype), Human immunodeficiency virus 2 (HIV-2)"
0.345416690042274,0.721750062984882,4.30556086151862,0.0550299965162672,0.806679195506207,"Human immunodeficiency virus 1 (HIV-1), HIV-1 M:K (subtype), HIV-1 M:F (subtype), unclassified Primate lentivirus group"
-0.417278136909307,2.23482106861639,3.84074958837941,0.0538701627829233,0.806679195506207,"Human mastadenovirus C, unclassified Human adenoviruses, unclassified Mastadenovirus"
-0.229120475101774,1.56468945012974,3.88598423948235,0.054530890665601,0.806679195506207,"Human mastadenovirus F, unclassified Human adenoviruses, unclassified Mastadenovirus"
-0.110277763200492,5.59026993336527,4.54249663030102,0.036458064524611,0.806679195506207,"Human orthorubulavirus 4, Human parainfluenza virus 4b"
-0.4618041050584,3.10088736751688,4.46953261797424,0.0379485197347123,0.806679195506207,"Human parvovirus B19, Erythroparvovirus primate1, Human erythrovirus V9"
-0.168790813156829,3.02638287900071,3.86222748773443,0.0532208083581612,0.806679195506207,"Human parvovirus B19, Human erythrovirus VX"
-0.243045332822121,1.59706696513064,4.59192225006622,0.0407515007201415,0.806679195506207,"Influenza A virus, H5N1 subtype, Influenza A virus H5N1 (subtype)"
0.187087019329077,6.1978830379211,3.84611314292497,0.0537072037376487,0.806679195506207,"Influenza A virus, Influenza A virus H3N2 (subtype), Influenza A virus with incomplete names (subtype)"
0.188577959624792,4.92860859516659,4.37079463469624,0.0400703225189865,0.806679195506207,"Influenza A virus, Influenza A virus with incomplete names (subtype)"
0.160397926792146,2.49915741159012,4.31431440082181,0.0413409825012268,0.806679195506207,"Louping ill virus, Omsk hemorrhagic fever virus, Powassan virus, Tick-borne encephalitis virus, Kyasanur Forest disease virus, Langat virus"
-0.228313976456364,1.83906731374541,3.96484959776859,0.0502328806395043,0.806679195506207,"Lyssavirus australis, Lyssavirus duvenhage, Lyssavirus rabies, Lyssavirus hamburg"
-0.118508702457046,3.42560995010172,3.94174142197694,0.0549645994732241,0.806679195506207,"Lyssavirus australis, Lyssavirus hamburg, Lyssavirus helsinki"
0.0427919831898189,7.65200922092254,4.39005330773378,0.0396466883817947,0.806679195506207,"Macaque simian foamy virus"
0.0168397412894123,12.0486506321595,4.82325385436318,0.0312812977642676,0.806679195506207,"Mammalian orthoreovirus"
0.0290208972105315,8.01778898857938,4.81132278863928,0.0314845184654677,0.806679195506207,"Melao orthobunyavirus"
-0.232818546331574,1.79478612242944,4.8336410349172,0.0311055132990464,0.806679195506207,"Monkeypox virus, Camelpox virus, Cowpox virus"
0.12809866010059,3.33773995184078,4.24036991438453,0.0430703618612076,0.806679195506207,"Monkeypox virus, Vaccinia virus, Akhmeta virus, unclassified Orthopoxvirus, Cowpox virus"
-0.0915918208432048,5.21558582550949,4.98863501943623,0.028603965056822,0.806679195506207,"Monkeypox virus, Vaccinia virus, Cowpox virus, Akhmeta virus, Ectromelia virus"
-0.095998250509431,4.29040176158253,5.06885730924338,0.0336295798204315,0.806679195506207,"Monkeypox virus, Vaccinia virus, Cowpox virus, Akhmeta virus, unclassified Orthopoxvirus"
