"logFC","logCPM","F","PValue","FDR","Species"
-0.037381329380387,1.47109907913715,0.113710900151897,0.736933719356455,0.989362286013424,"Cowpox virus, Variola virus, Monkeypox virus"
0.033244451972141,2.10888105634583,0.112940475170098,0.737792829597114,0.989362286013424,"Dengue virus 3, Dengue virus 2, Dengue virus"
0.031210010875893,1.98493715684823,0.110648522629327,0.74036808417643,0.989362286013424,"Dengue virus 4, Dengue virus 2, Dengue virus"
0.0238542091940772,7.12609882804059,0.114117562714718,0.736481553184565,0.989362286013424,"Enterovirus B, Echovirus E5 (Strain)"
0.0286089191840006,6.42459938337127,0.132613148578313,0.716799078485543,0.989362286013424,"Enterovirus B, Enterovirus B78 (Strain)"
0.0186201588618786,6.75464556144884,0.110014181569905,0.741086066998956,0.989362286013424,"Enterovirus B, Enterovirus B79 (Strain)"
0.0938618516900327,3.58760717275669,0.125561585011553,0.724108883604735,0.989362286013424,"Enterovirus B, Enterovirus B81 (Strain)"
0.0242610474785897,3.3574029255859,0.134119778636398,0.715266005408225,0.989362286013424,"Enterovirus B, Enterovirus D"
-0.0486687743982631,3.02797177228393,0.108067973704482,0.743303357783508,0.989362286013424,"Enterovirus B, unclassified Enterovirus, Coxsackievirus B3 (Strain), Echovirus E13 (Strain), Echovirus E17 (Strain), Echovirus E26 (Strain), Echovirus E6 (Strain), Enterovirus B79 (Strain), Coxsackievirus A9 (Strain), Enterovirus B107 (Strain), Echovirus E11 (Strain)"
-0.0203562757036481,11.7367143137445,0.117229067035246,0.733051265937992,0.989362286013424,"Enterovirus C"
0.0216157377010022,7.10163091362483,0.12460470038762,0.72511850603236,0.989362286013424,"Enterovirus C, Coxsackievirus A24 (Strain)"
0.0357442325247506,2.18513065340805,0.150768739848463,0.734278157259303,0.989362286013424,"Enterovirus C, Poliovirus 2_AAA46912.1 (Strain), Poliovirus 3_AAA46914.1 (Strain), Poliovirus 2_CAA25246.1 (Strain), Poliovirus 3_CAA25444.1 (Strain)"
0.0528700640876291,1.39803313115436,0.191743639847699,0.719481688326666,0.989362286013424,"Enterovirus C, Poliovirus 3_AAA46914.1 (Strain), Coxsackievirus A11 (Strain), Human Poliovirus 1 Mahoney (Strain), Human Poliovirus 1 Strain Sabin (Strain), Poliovirus 2_CAA25246.1 (Strain), Poliovirus 3_CAA25444.1 (Strain)"
0.0159482014623887,4.18486467842875,0.114424428698631,0.736140944973787,0.989362286013424,"Fort Sherman orthobunyavirus, Cache Valley orthobunyavirus"
-0.0063590054977751,7.24758115934675,0.132813125061994,0.716595025376564,0.989362286013424,"Gyrovirus homsa1"
0.00834126021971101,6.25549217210579,0.106687923343311,0.744889087695216,0.989362286013424,"Hantaan orthohantavirus, unclassified Orthohantavirus, Orthohantavirus hantanense"
0.00510554411646665,8.31295073602384,0.124279909462767,0.725462189576651,0.989362286013424,"Heartland bandavirus"
0.00909230118335634,13.9941455087199,0.12236550983035,0.727498291254019,0.989362286013424,"Human betaherpesvirus 5 (Human cytomegalovirus; CMV)"
0.0112488847642038,6.14559722352128,0.210551405793565,0.727577674219673,0.989362286013424,"Human betaherpesvirus 6A (Human herpesvirus 6A; HHV-6A), unclassified Human betaherpesvirus 6 (Human herpesvirus 6; HHV-6), Human betaherpesvirus 6B (Human herpesvirus 6B; HHV-6B)"
0.00522593430055549,10.8417377057144,0.11889946912567,0.731230704838211,0.989362286013424,"Human betaherpesvirus 6B (Human herpesvirus 6B; HHV-6B)"
0.0514934210761749,1.23910299254562,0.112471387626221,0.738317515064719,0.989362286013424,"Human bocavirus 1, Human bocavirus 3, Human bocavirus"
-0.0413267247245168,1.46288172675801,0.115008868664672,0.735493648305047,0.989362286013424,"Human immunodeficiency virus 1 (HIV-1), HIV-1 M:C (subtype), HIV-1 M:F (subtype), HIV-1 M:K (subtype)"
0.0841932650199869,0.33721147375227,0.120864458607099,0.729107322061792,0.989362286013424,"Human immunodeficiency virus 1 (HIV-1), HIV-1 M:K (subtype), HIV-1 M:B (subtype), HIV-1 M:F (subtype), HIV-1 N_Y (subtype)"
-0.00595990633443175,7.06234212303521,0.110547516475632,0.740482255167606,0.989362286013424,"Human immunodeficiency virus 1 (HIV-1), HIV-1 N_Y (subtype)"
0.061224269405243,0.585545379815097,0.113930018941191,0.743893983301167,0.989362286013424,"Human immunodeficiency virus 2 (HIV-2), HIV-2 subtype B (subtype), Human immunodeficiency virus 1 (HIV-1)"
-0.0109216932923043,6.08318260252695,0.109904899837029,0.741209990328797,0.989362286013424,"Human mammary tumor virus"
0.037146185037183,2.65411384315311,0.229511497660288,0.725010534502373,0.989362286013424,"Human mastadenovirus C, Human mastadenovirus A, Human mastadenovirus B, Human mastadenovirus F, Human mastadenovirus E, unclassified Mastadenovirus, Human mastadenovirus G, Human mastadenovirus D"
0.0280174008208313,3.01333971674247,0.126488214890739,0.723135307526933,0.989362286013424,"Human mastadenovirus C, Human mastadenovirus B, Human mastadenovirus E"
-0.0543948726827988,1.31575055780388,0.132536339512115,0.716877499727217,0.989362286013424,"Human mastadenovirus F, Human mastadenovirus B, Human mastadenovirus D"
-0.0180278394127488,4.37254342742137,0.134058348595506,0.715328321899534,0.989362286013424,"Human mastadenovirus F, unclassified Mastadenovirus, Human mastadenovirus G"
-0.0601071315680217,3.53609932327077,0.109863160682828,0.741257339774603,0.989362286013424,"Influenza A virus, Influenza A virus H3N2 (subtype), Influenza A virus H2N2 (subtype)"
-0.0199902713201928,3.35296008640418,0.107465806670651,0.74399388163018,0.989362286013424,"Influenza A virus, Influenza A virus H5N1 (subtype), Influenza A virus H1N1 (subtype), Influenza A virus H3N2 (subtype), Influenza A virus H7N9 (subtype), Influenza A virus H9N2 (subtype), Influenza A virus H7N7 (subtype)"
0.0475948151776444,1.28411621897976,0.140020027416488,0.738150327218177,0.989362286013424,"Influenza A virus, Influenza A virus H5N1 (subtype), Influenza A virus H1N1 (subtype), Influenza A virus H3N2 (subtype), Influenza A virus H9N2 (subtype)"
-0.0226686754629501,11.1446877089868,0.137833984556369,0.711527925313586,0.989362286013424,"Influenza B virus"
-0.0280137300250128,3.21148802336966,0.114023536932443,0.736586020039268,0.989362286013424,"Langat virus, Kyasanur Forest disease virus"
0.0382708793340005,2.35143089909574,0.173169300863382,0.720428510249348,0.989362286013424,"Louping ill virus, Tick-borne encephalitis virus, Omsk hemorrhagic fever virus, Langat virus"
0.0385266996988977,1.7897842149204,0.142818423490287,0.731408186478964,0.989362286013424,"Lyssavirus duvenhage, Lyssavirus hamburg, Lyssavirus rabies, Lyssavirus helsinki"
-0.00372530277497231,10.4840128295152,0.134985322987336,0.714389688900428,0.989362286013424,"Macacine alphaherpesvirus 1, Papiine alphaherpesvirus 2"
-0.00681500229469274,7.04707377581025,0.180484140855326,0.720932489151366,0.989362286013424,"Maldonado phlebovirus"
0.0159481152617181,3.68629407515695,0.104763941137627,0.747118896848615,0.989362286013424,"Mamastrovirus 9, unclassified Mamastrovirus"
-0.0173898300328869,3.93959958625218,0.126819710799633,0.741713911844311,0.989362286013424,"Melao orthobunyavirus, Jamestown Canyon orthobunyavirus"
-0.0380480389786653,2.41507421312226,0.193580804582889,0.722900031129934,0.989362286013424,"Monkeypox virus, Camelpox virus, Cowpox virus, Vaccinia virus"
0.0438520425638147,1.48326817961451,0.136107377285391,0.717279145900784,0.989362286013424,"Monkeypox virus, Camelpox virus, Ectromelia virus, Cowpox virus, Vaccinia virus"
-0.0166154241257997,4.21515630650343,0.15594333904671,0.724295105976563,0.989362286013424,"Monkeypox virus, Cowpox virus, Variola virus, unclassified Orthopoxvirus"
-0.0256001553355233,3.04210274110826,0.134663628520198,0.714715013251583,0.989362286013424,"Monkeypox virus, Vaccinia virus, Camelpox virus, Cowpox virus, Akhmeta virus, Variola virus, Ectromelia virus"
-0.00919342837612057,6.16360216839618,0.112760880519536,0.737993566767835,0.989362286013424,"Monkeypox virus, Vaccinia virus, Variola virus, unclassified Orthopoxvirus"
-0.0258815116223569,2.41770144873283,0.107316182415093,0.744165793020319,0.989362286013424,"Monkeypox virus, Variola virus, Camelpox virus, Cowpox virus, Vaccinia virus, unclassified Orthopoxvirus"
-0.02539027015339,3.43217682566187,0.167077189061323,0.746258312768896,0.989362286013424,"Oriboca orthobunyavirus, Marituba orthobunyavirus, Madrid orthobunyavirus"
-0.0413991632166873,2.23646202524402,0.21892350649824,0.732269465493786,0.989362286013424,"Oriboca orthobunyavirus, unclassified Orthobunyavirus, Marituba orthobunyavirus"
0.00372900603796297,8.71135760327659,0.111379681372229,0.739543351162661,0.989362286013424,"Orthobunyavirus shuniense"
-0.0128982801786596,4.99813064112295,0.109738396382741,0.741398933656129,0.989362286013424,"Orthohantavirus dobravaense, Hantaan orthohantavirus, Seoul orthohantavirus, Orthohantavirus seoulense, Orthohantavirus hantanense, unclassified Orthohantavirus"
-0.0440274879111768,1.53602730622422,0.163020530993875,0.722126147016812,0.989362286013424,"Orthohantavirus nigrorivense, Puumala orthohantavirus, Orthohantavirus puumalaense, Orthohantavirus tulaense"
-0.033319265056531,2.01037241382802,0.120040197907998,0.729995650066768,0.989362286013424,"Reston ebolavirus, Tai Forest ebolavirus"
-0.0369145690481489,8.36563208792057,0.122908129121377,0.726919368462178,0.989362286013424,"Rhinovirus A, Rhinovirus A16 (Strain)"
0.0441548681570742,1.71272887538081,0.124224907448104,0.725520441021369,0.989362286013424,"Rhinovirus A, Rhinovirus A31 (Strain), Rhinovirus A_ACU00187.1 (Strain)"
-0.0375033470506792,6.9446840545852,0.115957330165724,0.734447075781177,0.989362286013424,"Rhinovirus A, Rhinovirus A41 (Strain)"
-0.0324957956007081,7.76968567431812,0.112250869396449,0.738564591065854,0.989362286013424,"Rhinovirus A, Rhinovirus A61 (Strain)"
0.0452229246172331,4.10722538354268,0.114134170068504,0.736463106659907,0.989362286013424,"Rhinovirus A, Rhinovirus A63 (Strain)"
-0.113075098300111,5.02137020346795,0.12702802551972,0.722570001461067,0.989362286013424,"Rhinovirus A, unclassified Rhinovirus, Rhinovirus A7 (Strain)"
0.0296097491075798,2.29964561283991,0.124966278176448,0.729948510722571,0.989362286013424,"Rhinovirus C, Rhinovirus C_AET25077.2 (Strain), Rhinovirus C54 (Strain)"
-0.0232012173283171,6.27819282881882,0.117872355361256,0.732348441455782,0.989362286013424,"Rhinovirus C, Rhinovirus C_AFK79845.1 (Strain), Rhinovirus C32 (Strain)"
0.0470686746601261,3.24473055795415,0.127217144039598,0.722372271499925,0.989362286013424,"Rhinovirus C, Rhinovirus C3 (Strain), Rhinovirus C6 (Strain), Rhinovirus C_AMB19798.1 (Strain)"
-0.0326755198477433,7.26543052548565,0.115517720885423,0.734931562517677,0.989362286013424,"Rhinovirus C, Rhinovirus C31 (Strain)"
0.0378259407017591,6.72844012562628,0.122552096549824,0.727299058632298,0.989362286013424,"Rhinovirus C, Rhinovirus C53 (Strain)"
0.0334983851798306,2.2254412124593,0.154223315292918,0.720237124947042,0.989362286013424,"Rhinovirus C, Rhinovirus C6 (Strain), Rhinovirus C_AMB19798.1 (Strain)"
0.0839504406355067,2.72491612700462,0.110514796087423,0.740519252668586,0.989362286013424,"Rhinovirus C, unclassified Rhinovirus, Rhinovirus C44 (Strain)"
0.100212125646082,2.55982895971382,0.123150388340711,0.726661365027293,0.989362286013424,"unclassified Enterovirus, Enterovirus A, Enterovirus A89 (Strain), Enterovirus A90 (Strain), Enterovirus A91 (Strain), Enterovirus A121 (Strain)"
-0.0310835770396044,2.07583299304456,0.13655386670104,0.747365492289461,0.989362286013424,"unclassified Enterovirus, Enterovirus B106 (Strain)"
-0.0272974677394664,2.6221524336264,0.108988825408124,0.742251503499023,0.989362286013424,"unclassified Enterovirus, Rhinovirus A, Rhinovirus A7 (Strain)"
-0.00567355262267658,8.14303591690259,0.207996409941066,0.74540565949276,0.989362286013424,"unclassified Tibrovirus, Ekpoma virus 2"
0.0328485912241073,2.98798878150522,0.195182996654205,0.730497946629736,0.989362286013424,"Vaccinia virus, Cowpox virus, Monkeypox virus, Akhmeta virus, Variola virus, Ectromelia virus"
-0.0362824215702181,2.0028210988312,0.136462021564374,0.712901954174154,0.989362286013424,"Vaccinia virus, Monkeypox virus, Variola virus, Cowpox virus, Camelpox virus, Ectromelia virus"
-0.032365912953626,3.10924959581275,0.263966129411364,0.723497583095972,0.989362286013424,"Vaccinia virus, Variola virus, Camelpox virus, Cowpox virus, Akhmeta virus, Ectromelia virus"
0.0112658292788215,5.53889020604179,0.131365279840615,0.718076344337491,0.989362286013424,"Vaccinia virus, Variola virus, Cowpox virus"
-0.0176509273776845,4.78851250021641,0.124257177962635,0.725486262257367,0.989362286013424,"Vaccinia virus, Variola virus, Cowpox virus, Akhmeta virus"
-0.033292006576678,2.30180872080141,0.106386027897538,0.745237489809458,0.989362286013424,"Vaccinia virus, Variola virus, Cowpox virus, Akhmeta virus, unclassified Orthopoxvirus, Camelpox virus, Ectromelia virus"
-0.0354637934149778,2.23056197412225,0.224308543809471,0.741507997761135,0.989362286013424,"Variola virus, Cowpox virus, Vaccinia virus"
0.0343995663712683,1.79596127538259,0.108457596607118,0.743824651867775,0.989362286013424,"Variola virus, Monkeypox virus, Cowpox virus"
-0.0284636535244031,2.85643781105721,0.135538305046163,0.713831495299558,0.989362286013424,"Variola virus, Vaccinia virus, Akhmeta virus, Cowpox virus"
0.0360925090603575,2.00638693148062,0.135637079014905,0.7187795576823,0.989362286013424,"West Nile virus, Murray Valley encephalitis virus, Saint Louis encephalitis virus"
-0.00476394987579909,9.25628310679475,0.104940979446037,0.746912775695245,0.989362286013424,"Yellow fever virus"
0.0280119363552461,3.18325058180502,0.221395796855001,0.725232070838617,0.989362286013424,"Zaire ebolavirus, Tai Forest ebolavirus, Bundibugyo ebolavirus"
0.0209414069979041,3.26411781941181,0.112740986756793,0.748905981457073,0.990386580948127,"Cowpox virus, Vaccinia virus, Variola virus, Ectromelia virus"
0.00411794195351309,7.88605410985708,0.102622738069211,0.749627246256835,0.990386580948127,"Dengue virus 3"
0.0337606082767143,2.04976895499826,0.102045450888801,0.750308455294417,0.990386580948127,"Enterovirus D, Enterovirus D70 (Strain), Enterovirus D111 (Strain)"
-0.022226985533401,3.18639838020745,0.131261500638376,0.750291896847201,0.990386580948127,"Human immunodeficiency virus 1 (HIV-1), HIV-1 M:C (subtype), unclassified Primate lentivirus group"
-0.0362133299162282,1.86357013279532,0.161100734941244,0.75043180747767,0.990386580948127,"La Crosse orthobunyavirus, Snowshoe hare orthobunyavirus, Jamestown Canyon orthobunyavirus, Tahyna orthobunyavirus"
0.00500008986452518,7.39048419277284,0.102460804967075,0.749818116316461,0.990386580948127,"Pseudocowpox virus, Orf virus"
0.0467987486095017,1.26844862925553,0.100363850236156,0.752304972891393,0.992228961077586,"Japanese encephalitis virus, West Nile virus, Usutu virus"
0.0291476159512238,2.48267506282402,0.124524580294182,0.752593417237089,0.992228961077586,"Vaccinia virus, Monkeypox virus, Variola virus, Cowpox virus, Akhmeta virus, unclassified Orthopoxvirus, Camelpox virus, Ectromelia virus"
0.0224832503797377,6.5725960369163,0.098702467062243,0.754295664195979,0.993967646973044,"Enterovirus B, Echovirus E16 (Strain)"
0.0316008211487809,1.97418394414218,0.102365215576383,0.756751470396424,0.994069769818815,"Enterovirus A, unclassified Enterovirus, Coxsackievirus A5 (Strain), Coxsackievirus A10 (Strain)"
0.0207978202922709,6.62419509713355,0.0975029285136846,0.75574445053297,0.994069769818815,"Enterovirus B, Echovirus E11 (Strain)"
0.0409235383033875,1.24185034590321,0.0948067302883247,0.759037015439042,0.994069769818815,"Enterovirus B, Echovirus E31 (Strain), Enterovirus B86 (Strain)"
-0.00324934700784554,12.4875794168364,0.0941201850402933,0.759883592602302,0.994069769818815,"Human mastadenovirus D"
-0.0238530836080286,2.674942432519,0.112457466743967,0.760177031995679,0.994069769818815,"Ilheus virus, Tembusu virus"
-0.0220126224707035,2.72828414478505,0.0960953212477759,0.757457081842699,0.994069769818815,"Monkeypox virus, Variola virus, Cowpox virus, Akhmeta virus, Vaccinia virus, Camelpox virus, Ectromelia virus"
-0.022300233510332,3.15912761200263,0.0938728231346917,0.760189442450628,0.994069769818815,"Monkeypox virus, Variola virus, Cowpox virus, Camelpox virus"
-0.0309717455590569,1.86782801746329,0.0959106056379218,0.757682844131357,0.994069769818815,"Monkeypox virus, Variola virus, Cowpox virus, Vaccinia virus, unclassified Orthopoxvirus"
0.00522728536668386,7.12093414194854,0.0940530860259264,0.759966513417788,0.994069769818815,"New Jersey polyomavirus-2013"
-0.0902770689743932,3.16051765671875,0.0970324888709624,0.756315313561843,0.994069769818815,"Rhinovirus A, Rhinovirus A36 (Strain), Rhinovirus A58 (Strain)"
-0.0250276577455313,7.43419545356284,0.0936144362628932,0.760509395659996,0.994069769818815,"Rhinovirus B, Rhinovirus B35 (Strain)"
0.0384786302078443,1.39032344131254,0.097071024669791,0.756268494559578,0.994069769818815,"Tick-borne encephalitis virus, Louping ill virus"
-0.00462650128033189,7.70497286348442,0.0938784807576922,0.760182442172516,0.994069769818815,"unclassified Pegivirus, Pegivirus H"
0.02677749287389,2.32539807707714,0.0963067209569196,0.757198997809147,0.994069769818815,"unclassified Sapovirus, Sapporo virus"
-0.00615508800901614,7.0184387548333,0.0953353473760482,0.758387465596426,0.994069769818815,"Variola virus, Cowpox virus"
-0.0452047037496741,2.51267695016868,0.0981191223854462,0.754999003816685,0.994069769818815,"Variola virus, unclassified Orthopoxvirus, Cowpox virus"
0.0234466737509197,2.78259178854453,0.093093817499397,0.761155534640042,0.994412875900701,"Alphapapillomavirus 2, Alphapapillomavirus 4"
0.00961022431077063,6.07411101755644,0.0926398045593331,0.761720624988267,0.994649803511128,"Human immunodeficiency virus 1 (HIV-1), HIV-1 M:F (subtype)"
-0.0106977404827293,5.44763071797984,0.0908191723416512,0.764002033558456,0.9949269020852,"Human associated cyclovirus 8"
-0.00940247324915866,10.4186942830676,0.0906336521598109,0.764235903569303,0.9949269020852,"Human mastadenovirus E"
-0.0127708274845578,4.44841233437159,0.0913926677222473,0.763280720262292,0.9949269020852,"Lyssavirus australis, Lyssavirus hamburg, Lyssavirus rabies, Lyssavirus helsinki"
0.00935216848013285,4.88964803394975,0.0916469234486725,0.762961721442813,0.9949269020852,"Monkeypox virus, Cowpox virus, Ectromelia virus"
0.0434598087223062,4.93109527933307,0.0911814818929054,0.763546050725621,0.9949269020852,"Rhinovirus A, Rhinovirus A102 (Strain), Rhinovirus A65 (Strain)"
0.0255280715695818,2.35411059825173,0.0910851215702119,0.763667227790616,0.9949269020852,"Rhinovirus A, Rhinovirus A19 (Strain), Rhinovirus A60 (Strain)"
0.0222888826413569,6.48008504626697,0.0894678045560579,0.765711607844315,0.995961735494322,"Enterovirus B, Enterovirus B82 (Strain)"
0.024539337864564,2.3523869452731,0.0893530408024907,0.765857438969485,0.995961735494322,"Influenza A virus, Influenza A virus H3N2 (subtype), Influenza A virus H1N2 (subtype), Influenza A virus with incomplete names (subtype)"
0.00230672795790881,11.6018859843899,0.0890967124397218,0.766183526456666,0.995961735494322,"Yaba monkey tumor virus"
0.0539855722819121,0.708371988799227,0.0921068306454201,0.766673417612143,0.99609899671713,"Variola virus, Akhmeta virus, unclassified Orthopoxvirus, Cowpox virus"
-0.00272045158788991,11.2971451587719,0.0869862936221986,0.768887943946302,0.99665385616541,"Alphapapillomavirus 3"
-0.0383000733408434,1.4323749848399,0.0949180909437457,0.769383864593322,0.99665385616541,"Camelpox virus, unclassified Orthopoxvirus"
0.0348216396438031,2.16342711890742,0.1423076142994,0.769108910798917,0.99665385616541,"Cowpox virus, Monkeypox virus, Camelpox virus, Akhmeta virus, Ectromelia virus"
0.0112150002382019,6.23224407576513,0.086494126333592,0.76952375727754,0.99665385616541,"Human mastadenovirus F, Human mastadenovirus G"
0.00732072387191442,6.14290328361973,0.0877063038371677,0.767961304527449,0.99665385616541,"Monkeypox virus, Cowpox virus, Akhmeta virus, unclassified Orthopoxvirus, Vaccinia virus"
0.0242134589557167,2.54414014408678,0.0862868952985152,0.769792060201833,0.99665385616541,"Monkeypox virus, Vaccinia virus, Akhmeta virus, Cowpox virus"
0.0169030773695831,3.57791908749411,0.0871172100301006,0.768719147418748,0.99665385616541,"Tahyna orthobunyavirus, La Crosse orthobunyavirus"
-0.0486723579876297,0.965589457981626,0.0994234045193196,0.771287976585488,0.997594029595601,"Human bocavirus 1, Human bocavirus, Human bocavirus 3"
0.0349476067253326,1.57061285233827,0.0990741444857686,0.770926132565772,0.997594029595601,"Human bocavirus 2, Human bocavirus 4, Human bocavirus"
-0.0361660042705397,1.56850730676603,0.08464035480615,0.771936404207547,0.997934742995492,"Monkeypox virus, Cowpox virus, Akhmeta virus, Vaccinia virus, unclassified Orthopoxvirus"
-0.040583308651734,1.36003280543902,0.0983552526547979,0.773870224304757,0.999196172808769,"Dengue virus 1, Dengue virus 2, Dengue virus"
0.00512397344097271,7.77541069019945,0.0832766793478644,0.773729571257923,0.999196172808769,"Heron hepatitis B virus"
0.0151064566451496,3.57035613010574,0.083020172922328,0.774068640046299,0.999196172808769,"Monkeypox virus, Cowpox virus, Variola virus, Vaccinia virus"
-0.0175254055487285,4.21714307608895,0.169986704818735,0.776373427666879,0.999320482454602,"Cowpox virus, Monkeypox virus, Akhmeta virus, Variola virus, unclassified Orthopoxvirus, Vaccinia virus"
0.0354611371024015,1.45594278454508,0.101526794785962,0.777442462309358,0.999320482454602,"Human alphaherpesvirus 1 (Herpes simplex virus 1; HHV-1; HSV-1), Macacine alphaherpesvirus 1, Human alphaherpesvirus 1"
-0.013970958498745,4.17953099772955,0.0803899732582777,0.777578686898277,0.999320482454602,"Human bocavirus 3, Human bocavirus"
0.0348385606083514,1.49785814383665,0.0863748493306313,0.775256800170803,0.999320482454602,"Human bocavirus 3, Human bocavirus, Bocaparvovirus primate1"
-0.0260270312892685,2.37605445137873,0.0809455912534434,0.776832085400117,0.999320482454602,"Human mastadenovirus C, Human mastadenovirus B, Human mastadenovirus E, Human mastadenovirus D, Human mastadenovirus A, Human mastadenovirus F, unclassified Human adenoviruses, Human mastadenovirus G"
-0.0299402523877965,1.9660274982234,0.107140909646775,0.77686134925883,0.999320482454602,"Influenza A virus, Influenza A virus H1N1 (subtype), Influenza A virus H5N1 (subtype), Influenza A virus H3N2 (subtype), Influenza A virus H2N2 (subtype)"
0.0681048474932165,4.0044872366414,0.0803482944128292,0.777634804440946,0.999320482454602,"Rhinovirus A, unclassified Rhinovirus, Rhinovirus A16 (Strain)"
0.0357031082984449,1.81543219034057,0.119892457175737,0.774825858634858,0.999320482454602,"unclassified Human adenoviruses, Human mastadenovirus D"
0.019398523106359,3.14981467441955,0.100935412667786,0.776475221635309,0.999320482454602,"unclassified Mamastrovirus, Mamastrovirus 1"
-0.0116290151389652,4.68716415681634,0.108133797607234,0.778054516817168,0.999364374425223,"Argentinian mammarenavirus, Mammarenavirus machupoense"
-0.00313858744070182,6.45055176237189,0.0253330916350972,0.873982978259128,0.999604114793309,"African green monkey simian foamy virus, Simian foamy virus"
0.00124701154442928,8.69810774174286,0.00387365895052931,0.950544198390039,0.999604114793309,"Aichivirus A, unclassified Kobuvirus"
0.00362991416845247,2.34828689483829,0.00148984024094068,0.998595406056705,0.999604114793309,"Aichivirus B, unclassified Kobuvirus"
-0.028531461661793,2.36484715136566,0.112585557125308,0.790485507785108,0.999604114793309,"Akhmeta virus, Camelpox virus, Cowpox virus"
0.00240035071593672,6.1832497994899,0.00939037007978012,0.923070401331275,0.999604114793309,"Akhmeta virus, Cowpox virus"
-0.014187938843629,4.30584978582054,0.0931238974676525,0.980914480166654,0.999604114793309,"Akhmeta virus, Vaccinia virus"
-0.0181155446125737,3.37584056196185,0.0758599748109288,0.783772703540134,0.999604114793309,"Akhmeta virus, Vaccinia virus, Ectromelia virus, Cowpox virus"
-0.00207413647166364,8.44537545321881,0.0153655901080915,0.901691959686024,0.999604114793309,"Alenquer phlebovirus"
-0.000430881598706662,8.39685684476181,0.000983484052570012,0.975068280686444,0.999604114793309,"Alphapapillomavirus 13"
-0.000869769220327764,10.0653874445697,0.00972586392743284,0.921712644754102,0.999604114793309,"Alphapapillomavirus 6"
-0.00448857960027457,2.88762885087115,0.00468765194473929,0.945603051454147,0.999604114793309,"Andes orthohantavirus, Orthohantavirus nigrorivense, Hantaan orthohantavirus, Puumala orthohantavirus, Orthohantavirus sinnombreense, Orthohantavirus tulaense, Orthohantavirus hantanense, Orthohantavirus puumalaense, unclassified Orthohantavirus, Choclo orthohantavirus, Orthohantavirus bayoui"
0.0265287847267811,2.30401116195811,0.0868125200314948,0.840505660235552,0.999604114793309,"Andes orthohantavirus, Orthohantavirus nigrorivense, Puumala orthohantavirus, Orthohantavirus sinnombreense, Orthohantavirus puumalaense, unclassified Orthohantavirus, Choclo orthohantavirus, Orthohantavirus tulaense, Orthohantavirus bayoui"
-0.0124414336166891,3.37068438136188,0.0323314713327782,0.857804316205293,0.999604114793309,"Andes orthohantavirus, Orthohantavirus nigrorivense, unclassified Orthohantavirus, Choclo orthohantavirus, Orthohantavirus bayoui"
-0.0040872254652063,3.1503351352484,0.00323946720484981,0.954768617391088,0.999604114793309,"Andes orthohantavirus, Orthohantavirus puumalaense, Orthohantavirus tulaense"
0.00740255939533817,2.45105633652808,0.00956636296953106,0.922355152212299,0.999604114793309,"Andes orthohantavirus, Orthohantavirus sinnombreense, unclassified Orthohantavirus, Choclo orthohantavirus"
-0.0149406767753795,2.34561780627787,0.0364695970505347,0.867639372160598,0.999604114793309,"Andes orthohantavirus, Orthohantavirus sinnombreense, unclassified Orthohantavirus, Choclo orthohantavirus, Orthohantavirus negraense"
