"logFC","logCPM","F","PValue","FDR","Species"
0.234016998606188,4.2955574242198,0.548234226948051,0.46143419097869,0.948186298169041,"Rhinovirus A, unclassified Enterovirus, unclassified Rhinovirus, Rhinovirus A16 (Strain), Rhinovirus A81 (Strain)"
0.138652337089001,4.28265633994504,0.451773032529801,0.503633169163824,0.948186298169041,"Rhinovirus A, unclassified Rhinovirus, Rhinovirus A10 (Strain)"
-0.104282275306549,5.75759419095811,0.463173603442136,0.498314879855827,0.948186298169041,"Rhinovirus A, unclassified Rhinovirus, Rhinovirus A19 (Strain)"
-0.0731620220617469,8.11023019280582,0.600345606080814,0.440968969817965,0.948186298169041,"Rhinovirus A, unclassified Rhinovirus, Rhinovirus A45 (Strain)"
0.268228085295018,2.90752889365289,0.694405477932297,0.407410192677874,0.948186298169041,"Rhinovirus A, unclassified Rhinovirus, Rhinovirus A51 (Strain)"
-0.124683619715282,1.68608193370255,1.09346904353537,0.299181982138215,0.948186298169041,"Rhinovirus A, unclassified Rhinovirus, Rhinovirus A55 (Strain), Rhinovirus A21 (Strain)"
-0.0574368053399223,2.52011172487599,0.499890443694511,0.481817391145113,0.948186298169041,"Rhinovirus A, unclassified Rhinovirus, Rhinovirus A57 (Strain), Rhinovirus A_AEP69155.1 (Strain)"
-0.116823365225361,6.02037617854728,0.544416912070685,0.462992393774716,0.948186298169041,"Rhinovirus A, unclassified Rhinovirus, Rhinovirus A78 (Strain)"
0.239960939321197,4.63341822480279,0.535543465636819,0.466647382790238,0.948186298169041,"Rhinovirus A, unclassified Rhinovirus, Rhinovirus A8 (Strain), Rhinovirus A45 (Strain)"
-0.0662981609580504,7.49040798406695,0.549380944966729,0.460967751662628,0.948186298169041,"Rhinovirus B, Rhinovirus B101 (Strain)"
-0.0618096170521402,6.70700856495098,0.505906478930101,0.479201285305281,0.948186298169041,"Rhinovirus B, Rhinovirus B103 (Strain)"
0.28371294821416,4.99781373056985,0.918371614401466,0.341091677773476,0.948186298169041,"Rhinovirus B, Rhinovirus B17 (Strain)"
-0.0550097533955443,7.77226863610894,0.680427526086877,0.412148630756759,0.948186298169041,"Rhinovirus B, Rhinovirus B27 (Strain)"
-0.193641692833596,3.35891112165453,0.603174988634485,0.439898773634809,0.948186298169041,"Rhinovirus B, Rhinovirus B27 (Strain), Rhinovirus B93 (Strain), Rhinovirus B84 (Strain), Rhinovirus B97 (Strain)"
-0.0684547682128322,7.1974157260283,0.873605015995232,0.353065677907352,0.948186298169041,"Rhinovirus B, Rhinovirus B37 (Strain)"
-0.215469813652329,3.7201285347093,0.61390432484762,0.435876812720322,0.948186298169041,"Rhinovirus B, Rhinovirus B4 (Strain), Rhinovirus B27 (Strain), Rhinovirus B93 (Strain), Rhinovirus B5 (Strain), Rhinovirus B26 (Strain), Rhinovirus B42 (Strain), Rhinovirus B84 (Strain), Rhinovirus B99 (Strain)"
-0.0514854921373624,7.62119455535994,0.474585561492524,0.493086559163722,0.948186298169041,"Rhinovirus B, Rhinovirus B42 (Strain)"
-0.0883062862205774,2.26563604284473,0.838321702267889,0.362916278138618,0.948186298169041,"Rhinovirus B, Rhinovirus B48 (Strain), Rhinovirus B70 (Strain)"
0.0764873987006603,2.14946290054683,0.700195621136612,0.405471013043215,0.948186298169041,"Rhinovirus B, Rhinovirus B52_ABO69380.1 (Strain), Rhinovirus B69 (Strain), Rhinovirus B91 (Strain)"
0.127403723491547,5.47715065697608,0.914837698224858,0.342016495050802,0.948186298169041,"Rhinovirus B, Rhinovirus B6 (Strain)"
-0.0420718536449564,5.87280950465932,0.455178273821652,0.502034483294037,0.948186298169041,"Rhinovirus B, Rhinovirus B69 (Strain)"
-0.0662919172287868,3.70655300991575,1.0253110306977,0.314634035114749,0.948186298169041,"Rhinovirus B, Rhinovirus B69 (Strain), Rhinovirus B91 (Strain)"
0.0704730805520781,3.13390743696525,1.42700595454737,0.352536361043374,0.948186298169041,"Rhinovirus B, Rhinovirus B70 (Strain), Rhinovirus B17 (Strain)"
0.079714764002004,2.1584537851411,0.745548622846218,0.404013622774839,0.948186298169041,"Rhinovirus B, Rhinovirus B70 (Strain), Rhinovirus B52_ACK37393.1 (Strain)"
-0.0700462369593602,7.30738926955184,1.06108902470803,0.306395345108284,0.948186298169041,"Rhinovirus B, Rhinovirus B72 (Strain)"
-0.0457335368225057,6.74584029683498,0.489930350717797,0.486201049764315,0.948186298169041,"Rhinovirus B, Rhinovirus B92 (Strain)"
-0.141305305470955,5.57630138115073,0.905215036485762,0.344552158351473,0.948186298169041,"Rhinovirus B, Rhinovirus B99 (Strain)"
0.130776587240572,5.78656060516206,0.572432227208477,0.451748640471472,0.948186298169041,"Rhinovirus B, unclassified Rhinovirus, Rhinovirus B48 (Strain)"
-0.062305342071713,7.24171032279828,0.596460889900107,0.442444945478237,0.948186298169041,"Rhinovirus C, Rhinovirus C_AET72467.1 (Strain)"
-0.147442303973974,6.23052732982301,1.08496530109354,0.30105466439087,0.948186298169041,"Rhinovirus C, Rhinovirus C_AFK79845.1 (Strain)"
-0.0600561672787505,7.87563982560764,0.858605531588866,0.357207303688393,0.948186298169041,"Rhinovirus C, Rhinovirus C_AHK24839.1 (Strain)"
-0.0844292843410376,6.80435577226142,0.757462475477653,0.386999835559655,0.948186298169041,"Rhinovirus C, Rhinovirus C2 (Strain)"
-0.0555950266525891,7.73013610759048,0.462519841500785,0.498617252308701,0.948186298169041,"Rhinovirus C, Rhinovirus C3 (Strain)"
0.0743450445442315,6.81492948820954,0.727764488194207,0.396421815526462,0.948186298169041,"Rhinovirus C, Rhinovirus C32 (Strain)"
-0.0684486602137414,7.89102192384368,1.03420758325638,0.31255832790368,0.948186298169041,"Rhinovirus C, Rhinovirus C44 (Strain)"
-0.052373395685014,7.28077253673484,0.790072802563896,0.377021364810874,0.948186298169041,"Rhinovirus C, Rhinovirus C56 (Strain)"
-0.238091808251704,5.03193348926473,0.674855194276129,0.414060520734512,0.948186298169041,"Rhinovirus C, Rhinovirus C56 (Strain), Rhinovirus C28 (Strain)"
-0.0919956744127593,5.90555698483635,0.793633615226086,0.375954127654241,0.948186298169041,"Rhinovirus C, Rhinovirus C6 (Strain)"
-0.0659798730950984,7.39995332269026,0.485416781366466,0.488209533900626,0.948186298169041,"Rhinovirus C, Rhinovirus C7 (Strain)"
-0.0696508160697347,7.47357064811218,0.720662870927598,0.398724296533112,0.948186298169041,"Rhinovirus C, Rhinovirus C8 (Strain)"
0.06097115527836,2.94983539291918,0.668740544107048,0.455055815085704,0.948186298169041,"Rhinovirus C, Rhinovirus C8 (Strain), Rhinovirus C31 (Strain)"
0.184647170529258,4.10400829425496,0.462603784856532,0.498578410011259,0.948186298169041,"Rhinovirus C, unclassified Rhinovirus, Rhinovirus C_AFK79845.1 (Strain)"
0.042897405866003,4.49256199163832,1.05132333110308,0.308615594652451,0.948186298169041,"Rotavirus H"
0.0108766603834012,9.0335680540155,0.997757949555285,0.32117989490942,0.948186298169041,"Saint Louis encephalitis virus"
0.0623881359436215,2.65864399835267,0.535629358016741,0.486428553216887,0.948186298169041,"Semliki Forest virus, Mayaro virus"
-0.0703850566364616,2.14915666256213,0.747899155509878,0.449116018505726,0.948186298169041,"Semliki Forest virus, Ross River virus, Getah virus"
0.117058129190919,1.50134683616075,0.801161219809095,0.373712064247206,0.948186298169041,"Seoul orthohantavirus, Orthohantavirus seoulense, unclassified Orthohantavirus, Orthohantavirus hantanense"
-0.0131335148731025,8.56926122671169,1.01096170644191,0.318020660458737,0.948186298169041,"SFTS phlebovirus"
-0.00764351812938227,9.04357224936694,0.470632336596487,0.494887119589259,0.948186298169041,"Sicilian phlebovirus"
0.0134458802750021,7.17355728673532,0.508756875627571,0.477969959280261,0.948186298169041,"Simian foamy virus, Macaque simian foamy virus"
0.0303298978173206,4.13022154962754,0.479214190648334,0.490992408528585,0.948186298169041,"Snowshoe hare orthobunyavirus, La Crosse orthobunyavirus"
-0.0141053405632095,8.15564412600806,1.00080071137573,0.320448162610452,0.948186298169041,"Spondweni virus"
0.0800283346654904,2.42847364961225,0.799317764279739,0.378923700971333,0.948186298169041,"Sudan ebolavirus, Bundibugyo ebolavirus"
0.00524483241676286,12.2379313937873,0.570716461214027,0.452424718495931,0.948186298169041,"Suid alphaherpesvirus 1"
0.0473897324800132,4.09194793549804,0.951920873023093,0.366829438702686,0.948186298169041,"Tai Forest ebolavirus, Bundibugyo ebolavirus"
0.0157705676698798,7.31297630956623,0.775864958155106,0.381322986146831,0.948186298169041,"Thogotovirus dhoriense"
0.226812127253926,0.216927646507339,0.991384958078577,0.338148538713365,0.948186298169041,"Tick-borne encephalitis virus, Louping ill virus, Omsk hemorrhagic fever virus"
0.0295084261299165,6.24791083517619,1.01162744099359,0.317862469794917,0.948186298169041,"Torque teno midi virus 11"
0.0264823853622632,6.12541306334556,1.05037404745284,0.308832544362805,0.948186298169041,"Torque teno midi virus 15"
-0.0316716676803624,6.42190240239276,0.654772201730346,0.421062497451021,0.948186298169041,"Torque teno midi virus 9"
0.0151729021228838,8.84571869625868,0.951320241305521,0.332630613081056,0.948186298169041,"Torque teno mini virus 10"
0.0312060375352082,6.00994933117754,0.799997270398945,0.374057498624016,0.948186298169041,"Torque teno mini virus 11"
-0.0307864032304445,5.79271808626284,0.502084677604218,0.480860483714605,0.948186298169041,"Torque teno mini virus 16"
0.0370167315327246,6.08734877881989,0.672924574210432,0.414726016295918,0.948186298169041,"Torque teno mini virus 27"
0.0456143195217802,6.19918713631008,0.913380083216982,0.342398946967049,0.948186298169041,"Torque teno mini virus 3"
0.0199067159703732,6.28608704617794,0.432023161175861,0.513081704263888,0.948186298169041,"Torque teno mini virus 6"
0.00979241824799386,8.66591845649994,0.523220887169174,0.471801103964733,0.948186298169041,"Torque teno virus 1"
-0.0294808639007908,6.62508180979351,0.573540328780375,0.451312853656888,0.948186298169041,"Torque teno virus 16"
0.0175182391743013,6.11808768597748,0.534235971794922,0.467189879776591,0.948186298169041,"Torque teno virus 2"
0.0167691270797236,6.4393047016978,0.556924108527494,0.459124635459855,0.948186298169041,"Torque teno virus 21"
-0.0135898818015387,6.69710338102613,0.431596779671919,0.5132890923753,0.948186298169041,"Torque teno virus 27"
-0.0304106600245575,6.43404608901426,0.546505882157444,0.462138644971542,0.948186298169041,"Torque teno virus 28"
0.0115585550404414,10.5271294875655,0.42732570922563,0.51537465090147,0.948186298169041,"TTV-like mini virus"
0.0366528562225769,4.73483328072647,1.12555685334373,0.292250810493144,0.948186298169041,"TTV-like mini virus, unclassified Betatorquevirus"
0.0669818824954808,3.32138481670475,0.992838682401513,0.322367621290785,0.948186298169041,"unclassified Betapapillomavirus"
0.0744895183666861,2.20399531997007,0.66197499831806,0.418530898664728,0.948186298169041,"unclassified Betatorquevirus, TTV-like mini virus"
0.0149499833770598,8.8903817727741,1.12007706389441,0.29341959376858,0.948186298169041,"unclassified Chapparvovirus"
0.0327889586298177,5.46554003580346,1.53104334958113,0.295980434112816,0.948186298169041,"unclassified Circovirus"
0.0312058227611656,5.35911300822656,0.52440018305786,0.471303886022651,0.948186298169041,"unclassified Cosavirus, Human cosavirus A"
-0.135843891558667,1.31187380614777,1.15703589727433,0.320506400883322,0.948186298169041,"unclassified Enterovirus, Coxsackievirus A3 (Strain), Coxsackievirus A7 (Strain)"
-0.045450857498894,4.29837718598666,1.31328320619169,0.425495858274722,0.948186298169041,"unclassified Enterovirus, Enterovirus A, Enterovirus A90 (Strain)"
0.0940352713058254,1.20836643434011,0.456059320041396,0.515068273338792,0.948186298169041,"unclassified Enterovirus, Enterovirus A125 (Strain)"
-0.0633896434509851,3.00933887758703,0.553628512530739,0.459246572602128,0.948186298169041,"unclassified Enterovirus, Enterovirus B, Echovirus E7 (Strain)"
0.0656382461154363,5.20457598939483,0.566413061263422,0.454127485470219,0.948186298169041,"unclassified Enterovirus, Enterovirus B113 (Strain)"
0.0872188294456483,5.21698878454111,0.909283372688517,0.34347698537532,0.948186298169041,"unclassified Enterovirus, Enterovirus B73 (Strain)"
0.0699238890127305,2.72291724958874,1.01914387168433,0.321998382781713,0.948186298169041,"unclassified Enterovirus, Enterovirus B84 (Strain)"
-0.0252144544316088,5.95042365474452,0.586020033957387,0.446450295398631,0.948186298169041,"unclassified Enterovirus, Enterovirus C, Coxsackievirus A17 (Strain)"
-0.0320657649269933,4.39645531726755,0.619270876687215,0.469674011368618,0.948186298169041,"unclassified Enterovirus, Enterovirus C, Coxsackievirus A24 (Strain)"
-0.117009870736496,2.0885194106273,0.471871431527442,0.494321556830887,0.948186298169041,"unclassified Enterovirus, Enterovirus C, Enterovirus C96 (Strain), Enterovirus C99 (Strain)"
0.0843616225942421,1.87028400952993,0.586211938681588,0.446376165580999,0.948186298169041,"unclassified Enterovirus, Enterovirus D111 (Strain)"
-0.0717625269938832,4.90573803128263,0.632401296645908,0.429074838697766,0.948186298169041,"unclassified Enterovirus, Enterovirus G"
-0.0757282213225982,2.78614113309722,0.897100832785023,0.346710380961368,0.948186298169041,"unclassified Enterovirus, Rhinovirus C, Rhinovirus C_AER92563.1 (Strain)"
-0.109742687997755,5.27481463475366,0.641792641130486,0.425683279433838,0.948186298169041,"unclassified Enterovirus, Rhinovirus C, Rhinovirus C4 (Strain), Rhinovirus C_AER92563.1 (Strain)"
-0.0147462820602111,6.98267169165751,0.695815936929289,0.414390815419905,0.948186298169041,"unclassified Gammapapillomavirus, Gammapapillomavirus 12"
0.014119499331636,6.6156226732886,0.459477961193191,0.500028289149264,0.948186298169041,"unclassified Gammapapillomavirus, Gammapapillomavirus 20"
-0.0759795569763085,2.98551092671304,1.06704352199277,0.305051878489189,0.948186298169041,"unclassified Human adenoviruses, Human mastadenovirus A"
0.0334489945915584,4.09605384909615,0.75354683558843,0.399319713782111,0.948186298169041,"unclassified Human adenoviruses, Human mastadenovirus F"
0.0960727315773001,1.68548333332549,1.02421227072657,0.404263503033046,0.948186298169041,"unclassified Human adenoviruses, Human mastadenovirus F, Human mastadenovirus A"
-0.024315390766956,8.59969993077914,1.10050707340538,0.297643559943152,0.948186298169041,"unclassified Human betaherpesvirus 6 (Human herpesvirus 6; HHV-6), Human betaherpesvirus 6B (Human herpesvirus 6B; HHV-6B)"
-0.0392010154903479,4.89006382015562,0.490197286508636,0.486082699543471,0.948186298169041,"unclassified Human betaherpesvirus 6 (Human herpesvirus 6; HHV-6), Human betaherpesvirus 6B (Human herpesvirus 6B; HHV-6B), Human betaherpesvirus 6A (Human herpesvirus 6A; HHV-6A)"
0.00743398006975174,9.65923898068826,0.467495058979883,0.49632399508959,0.948186298169041,"unclassified Kobuvirus"
0.0354254553969255,3.95314410234459,0.565374695120689,0.495136952565732,0.948186298169041,"unclassified Mamastrovirus, Mamastrovirus 1, Mamastrovirus 8"
0.0333643189860612,3.939595920606,0.481597937262685,0.48991976143539,0.948186298169041,"unclassified Mamastrovirus, Mamastrovirus 4, Mamastrovirus 3"
0.00946076817582931,10.0612438631876,1.10321436752793,0.297054526712272,0.948186298169041,"unclassified Mastadenovirus"
0.0111916923760762,7.11901786042723,0.427212824192584,0.515429974583402,0.948186298169041,"unclassified Orthobunyavirus, Marituba orthobunyavirus"
0.0224806536262999,6.269380240042,0.71709437937251,0.399888664711975,0.948186298169041,"unclassified Orthohantavirus, Orthohantavirus negraense"
0.0513245342184306,3.89548493633528,1.02174336052721,0.315471561056308,0.948186298169041,"unclassified Orthohantavirus, Orthohantavirus seoulense"
0.0450654022482212,4.23574119225421,1.21081286953653,0.293818468696969,0.948186298169041,"unclassified Orthopoxvirus, Camelpox virus"
-0.0563297404101791,2.99537981954992,0.920042635277593,0.345059012142577,0.948186298169041,"unclassified Orthopoxvirus, Vaccinia virus"
0.0102774199154785,8.36613934014056,0.436133080609217,0.511090176022007,0.948186298169041,"unclassified Pegivirus, Pegivirus H, Pegivirus platyrrhini"
-0.0491429172778946,3.73324638111787,0.561982160174038,0.455891344797111,0.948186298169041,"unclassified Pegivirus, Pegivirus platyrrhini"
0.0881839097437802,6.58670917842003,0.562559584418588,0.455660866838443,0.948186298169041,"unclassified Rhinovirus"
0.0651881361584844,2.35654638069182,0.978517005956996,0.444637287819124,0.948186298169041,"unclassified Rhinovirus, Rhinovirus A, Rhinovirus A21 (Strain)"
-0.0652082117392652,3.12765378503342,0.925694218524739,0.376249197159631,0.948186298169041,"unclassified Rhinovirus, Rhinovirus A, Rhinovirus A82 (Strain)"
0.207673744719177,0.122832540349937,0.663696310803121,0.417929294464778,0.948186298169041,"unclassified Rhinovirus, Rhinovirus A106 (Strain)"
-0.0973753006935642,1.21766485406622,0.556156770279157,0.480622171686714,0.948186298169041,"unclassified Rhinovirus, Rhinovirus A19 (Strain)"
0.170198885902328,1.54062128335908,0.631007217118918,0.429581803036467,0.948186298169041,"unclassified Rhinovirus, Rhinovirus A73 (Strain), Rhinovirus A82 (Strain)"
-0.13358336920141,1.17176850119297,0.482466210275703,0.489530031879542,0.948186298169041,"unclassified Rhinovirus, Rhinovirus A78 (Strain)"
-0.0848019165694311,7.38169758110367,0.627740023701286,0.430773529158168,0.948186298169041,"unclassified Rhinovirus, Rhinovirus A8 (Strain)"
0.201320445768295,2.90180215585888,0.554104904645806,0.459054172588828,0.948186298169041,"unclassified Rhinovirus, Rhinovirus A81 (Strain)"
0.143611847781321,3.20894985455188,0.912287628336149,0.342685970684318,0.948186298169041,"unclassified Rhinovirus, Rhinovirus A82 (Strain)"
-0.201552683910964,0.253739689870818,0.692169941970532,0.408162572880119,0.948186298169041,"unclassified Rhinovirus, Rhinovirus A94 (Strain)"
-0.151497308844961,0.544989868012804,0.731974236318036,0.440728002211604,0.948186298169041,"unclassified Rhinovirus, Rhinovirus B102 (Strain)"
0.147876893829993,0.938305278971542,1.25993890858382,0.34712907290997,0.948186298169041,"unclassified Rhinovirus, Rhinovirus C_AET72467.1 (Strain)"
0.301855672550126,3.41747689493233,1.06863360787864,0.304694429013356,0.948186298169041,"unclassified Rhinovirus, Rhinovirus C, Rhinovirus C19 (Strain)"
-0.0877543926077496,1.39610306931432,0.595743178594675,0.477523427420526,0.948186298169041,"unclassified Rhinovirus, Rhinovirus C54 (Strain)"
0.0251065544850748,5.99467222434478,0.586309951108699,0.446338312341398,0.948186298169041,"unclassified Sapovirus"
0.0145580706738867,8.16502279405295,1.37357528292823,0.308844637675624,0.948186298169041,"Usutu virus"
-0.0346961029620499,3.7746681422046,0.47915382112831,0.49101962515984,0.948186298169041,"Usutu virus, Murray Valley encephalitis virus"
0.09278284501655,1.17659055793452,0.512201466031611,0.505664650528206,0.948186298169041,"Vaccinia virus, Akhmeta virus, Ectromelia virus, Cowpox virus"
0.0341444675972041,4.83542512136746,0.561466352063961,0.456097385564491,0.948186298169041,"Vaccinia virus, Akhmeta virus, unclassified Orthopoxvirus, Monkeypox virus"
-0.0819800860577382,1.81920598348825,0.561852054114185,0.455943302008595,0.948186298169041,"Vaccinia virus, Akhmeta virus, Variola virus, Camelpox virus, Cowpox virus"
0.024629099426728,5.0422696397401,0.441825678621285,0.508353934077509,0.948186298169041,"Vaccinia virus, Camelpox virus"
0.0656221200626258,2.49227336083955,0.78059484919448,0.392246401281711,0.948186298169041,"Vaccinia virus, Cowpox virus, Akhmeta virus, Camelpox virus, Ectromelia virus"
-0.040751036077973,4.30570068104046,0.94854368091923,0.333332565893801,0.948186298169041,"Vaccinia virus, Cowpox virus, Akhmeta virus, Ectromelia virus"
0.034409680272493,4.32258493866115,0.651629112860685,0.422174459032692,0.948186298169041,"Vaccinia virus, Cowpox virus, Ectromelia virus"
0.125145224089124,2.58815680457469,0.58245209718961,0.447832057631497,0.948186298169041,"Vaccinia virus, Cowpox virus, Monkeypox virus, Variola virus"
-0.0986682440657883,2.19967004247596,0.943370197367168,0.334645850257169,0.948186298169041,"Vaccinia virus, Cowpox virus, Monkeypox virus, Variola virus, Akhmeta virus"
-0.105485166151422,1.60624799251282,0.907676975346856,0.364085371286091,0.948186298169041,"Vaccinia virus, Cowpox virus, Monkeypox virus, Variola virus, Camelpox virus"
-0.0347793332115849,4.78292686514746,0.668927940255064,0.416108776326109,0.948186298169041,"Vaccinia virus, Cowpox virus, Variola virus"
-0.0416162154892393,4.17650533886907,0.759358161532037,0.472125967677822,0.948186298169041,"Vaccinia virus, Ectromelia virus"
0.0422657185185629,4.4356551642727,0.823085066235843,0.367288981429354,0.948186298169041,"Vaccinia virus, Monkeypox virus, Cowpox virus"
-0.0640056000108396,1.95674059429285,0.429793599229809,0.514167771433865,0.948186298169041,"Vaccinia virus, Monkeypox virus, Cowpox virus, Akhmeta virus"
-0.0308399261325118,4.34765685366744,0.493758369080615,0.492166838050395,0.948186298169041,"Vaccinia virus, Variola virus, Camelpox virus"
0.0547523987500433,3.8723482480852,1.06177324335209,0.306240575402859,0.948186298169041,"Vaccinia virus, Variola virus, Camelpox virus, Cowpox virus"
-0.0647192650166355,3.2250167322474,1.0399526489571,0.368672062795246,0.948186298169041,"Vaccinia virus, Variola virus, Camelpox virus, Cowpox virus, unclassified Orthopoxvirus"
-0.0952315644660402,2.26627422878621,0.946589455114801,0.333827823105609,0.948186298169041,"Vaccinia virus, Variola virus, Cowpox virus, Akhmeta virus, unclassified Orthopoxvirus"
-0.0487574510836916,3.95747362892646,0.988096175102596,0.323518235175227,0.948186298169041,"Vaccinia virus, Variola virus, Cowpox virus, Camelpox virus"
-0.0371439643276269,3.94301089026615,0.610807866672754,0.448437910228961,0.948186298169041,"Vaccinia virus, Variola virus, Cowpox virus, Camelpox virus, Ectromelia virus"
-0.0959078867051908,1.26356235150751,0.539898941860379,0.495131845864684,0.948186298169041,"Vaccinia virus, Variola virus, unclassified Orthopoxvirus, Akhmeta virus, Cowpox virus"
0.0655899904025807,2.07750121671332,0.504980594446852,0.479602379574807,0.948186298169041,"Variola virus, Akhmeta virus, Cowpox virus"
0.0428565822058942,3.64919038700679,0.487577138742132,0.487246471426946,0.948186298169041,"Variola virus, Akhmeta virus, unclassified Orthopoxvirus, Vaccinia virus"
0.0604597551339149,2.51739938935429,0.540136970471571,0.475115936409672,0.948186298169041,"Variola virus, Akhmeta virus, Vaccinia virus, Cowpox virus, Camelpox virus"
-0.112556299152675,1.68378450086043,0.999707784293296,0.320710736648751,0.948186298169041,"Variola virus, Camelpox virus, Cowpox virus, Vaccinia virus"
0.0638196386468155,3.16904206153547,1.03239539496908,0.312979666423142,0.948186298169041,"Variola virus, Cowpox virus, Akhmeta virus"
-0.0649716853180285,2.10064809487225,0.439955602314311,0.509249997885961,0.948186298169041,"Variola virus, Cowpox virus, Akhmeta virus, Vaccinia virus, Camelpox virus, Ectromelia virus"
-0.0366774750616846,4.61361933091606,0.734638097201628,0.394211698101991,0.948186298169041,"Variola virus, Monkeypox virus, Cowpox virus, Vaccinia virus, Camelpox virus"
-0.0462892057838353,3.98871012678498,0.919710709317343,0.356092493092165,0.948186298169041,"Variola virus, unclassified Orthopoxvirus, Vaccinia virus"
-0.0546974199108116,5.48529169079439,1.02190248503396,0.315434142920941,0.948186298169041,"Variola virus, Vaccinia virus"
0.101386727110545,2.04827057386496,1.03634063246283,0.314305951661505,0.948186298169041,"Variola virus, Vaccinia virus, Cowpox virus"
0.0611649529201732,3.02482568484493,0.700958036700661,0.405216689397153,0.948186298169041,"Variola virus, Vaccinia virus, Cowpox virus, Akhmeta virus, unclassified Orthopoxvirus"
0.0696390035483825,2.05909284631098,0.648816967796529,0.503372054671716,0.948186298169041,"Venezuelan equine encephalitis virus, Madariaga virus"
-0.0275527917347748,6.06029610463976,1.73565054822962,0.335572629531336,0.948186298169041,"Vientovirus, Brisavirus"
-0.0105090140049383,8.42974193133597,0.802047894030729,0.373449222504394,0.948186298169041,"Wyeomyia orthobunyavirus"
0.0113316094954382,9.3175564976647,1.09145734337093,0.299623619110106,0.948186298169041,"Zaire ebolavirus"
-0.0745590133731587,1.54221481322741,0.438282038836133,0.510054234519027,0.948186298169041,"Zaire ebolavirus, Reston ebolavirus, Tai Forest ebolavirus, Bundibugyo ebolavirus"
0.0742456083109643,1.84799701015367,0.426080539452842,0.515985473723484,0.948534998504447,"Dengue virus 4, Dengue virus, Dengue virus 2, Dengue virus 1"
-0.0560423483802201,2.56996276992605,0.450791930945358,0.518188508561338,0.949623472874097,"Cowpox virus, Monkeypox virus, Akhmeta virus, Variola virus, unclassified Orthopoxvirus, Camelpox virus"
0.034520241261606,4.12269020624458,0.421164828610525,0.518409419026561,0.949623472874097,"Mamastrovirus 1, Mamastrovirus 4"
0.156721421545701,4.29451972729379,0.422812769580794,0.517594578347056,0.949623472874097,"Rhinovirus A, unclassified Rhinovirus, Rhinovirus A55 (Strain)"
-0.0765148569806384,1.70586716480685,0.488635607041112,0.51749504795325,0.949623472874097,"Torque teno virus 10, Torque teno virus 12"
0.101676151529245,0.968789902873081,0.442550135329976,0.517679360694659,0.949623472874097,"Western equine encephalitis virus, Eastern equine encephalitis virus, Madariaga virus"
0.0942354752864784,2.3786917314393,0.418632320805825,0.519666079586381,0.951253162632697,"Rhinovirus A, Rhinovirus A40 (Strain), Rhinovirus A56 (Strain)"
0.0293735820428868,4.24604784089294,0.416713675967189,0.520621737890265,0.952329953854317,"Marituba orthobunyavirus, Madrid orthobunyavirus, unclassified Orthobunyavirus"
-0.0901193145638013,4.56688969689336,0.412849210202154,0.522556110670732,0.952349875315241,"Enterovirus B, Enterovirus B106 (Strain)"
-0.0751181540501247,5.02932644088554,0.412872956731644,0.522544185150849,0.952349875315241,"Enterovirus C, unclassified Enterovirus, Human Poliovirus 1 Strain Sabin (Strain)"
-0.042816072242397,9.36993025667074,0.412289889840086,0.5228371421966,0.952349875315241,"Human respiratory syncytial virus B, Respiratory syncytial virus"
-0.0288202944504794,4.52348815633344,0.413300656711146,0.522329477102755,0.952349875315241,"Monkeypox virus, Variola virus, Akhmeta virus"
